entityType,id,created,teaserType,seriesReference,title,titleId,videoType,videoId,seriesId,shortDescription,description,shortDescriptionNoTags,descriptionNoTags,metaDescription,tvRating,originalPremierDate,originalPremierDateFormatted,season,episode,mediaID,authRequired,url,canonicalUrl,duration,releaseYear,durationFormatted,squeezetime,episodeReference,movieReference,seriesPrimaryCollection,isPlayable,ads,tags,deeplinkTitle,deeplinkUri,startTime,endTime,availableOn,airsOn,expireDateFormatted,expiresOn,newStatus,availabilityInfo,images
video,8388,1491620401,,,Angels in the Infield,459360,movie,459360,NaN,The career of Eddie Everett as pitcher for the Anaheim Angels is on a downturn as his errors cost the team the American League pennant in 1992. His estranged wife informs Eddie their daughter will be living with him for the next six months.,"The career of Steady Eddie Everett, a pitcher for the Anaheim Angels, is on a downturn as are the fortunes of his team ever since his errors cost the team the American League pennant in 1992. To make matters worse, his estranged wife, Claire, informs Eddie that their 13-year-old daughter, Laurel, will be living with him for the next six months. Eddie, who has not even seen his daughter in six years, is horrified at the idea, but father and daughter are stuck with each other. In answer to Laurel's prayers that heaven gives Eddie another chance, a team of baseball-playing angels led by Bob Bugler, who is trying to earn his wings, comes to Earth to help Eddie and his team.As father and daughter draw closer together, Laurel beseeches her father to believe in himself. With the help of the angels, the Anaheim Angels go on a winning streak. Unhappy about this situation, the Devil makes a pact with Eddie's old foe, Randy Fleck, to win the pennant for the Arizona Crimson Devils and ruin Eddie's life. At the championship game, some devils get into the game. Bob is outraged, but it's against the rules of heaven for him to intervene in championship games and there is nothing he can do. It's up to Eddie alone to discover if he's got what it takes.",The career of Eddie Everett as pitcher for the Anaheim Angels is on a downturn as his errors cost the team the American League pennant in 1992. His estranged wife informs Eddie their daughter will be living with him for the next six months.,"The career of Steady Eddie Everett, a pitcher for the Anaheim Angels, is on a downturn as are the fortunes of his team ever since his errors cost the team the American League pennant in 1992. To make matters worse, his estranged wife, Claire, informs Eddie that their 13-year-old daughter, Laurel, will be living with him for the next six months. Eddie, who has not even seen his daughter in six years, is horrified at the idea, but father and daughter are stuck with each other. In answer to Laurel's prayers that heaven gives Eddie another chance, a team of baseball-playing angels led by Bob Bugler, who is trying to earn his wings, comes to Earth to help Eddie and his team.As father and daughter draw closer together, Laurel beseeches her father to believe in himself. With the help of the angels, the Anaheim Angels go on a winning streak. Unhappy about this situation, the Devil makes a pact with Eddie's old foe, Randy Fleck, to win the pennant for the Arizona Crimson Devils and ruin Eddie's life. At the championship game, some devils get into the game. Bob is outraged, but it's against the rules of heaven for him to intervene in championship games and there is nothing he can do. It's up to Eddie alone to discover if he's got what it takes.",,TV-PG,False,,,,157d107e0caab21adaec783a12f90dd281d50a5e,1,\/movies\/angels-in-the-infield,https:\/\/www.tntdrama.com\/movies\/angels-in-the-infield,5166.895,2000,86 min,10,,,,1,"{'banner': 'NaN', 'rectangle': 'NaN', 'display_presented': False, 'sponsor_120x42': 'NaN', 'mobile_ad': 'NaN', 'display_ad_inventory_id': 'NaN'}",[],Watch On the App,https:\/\/tnt.app.link\/UY4KZKacBS,1585728000,1588319999,,,Expires April 30,,False,,"{'main_846x700': {'fid': '11017', 'url': 'https:\\/\\/images.tntdrama.com\\/tnt\\/$dyna_params\\/https%3A%2F%2Fi.cdn.tntdrama.com%2Fassets%2Fimages%2F2018%2F12%2FAngelsInTheOutfield-LiveTV-846x700.jpg', 'type': 'video'}, 'main_1024x1536': {'fid': '11013', 'url': 'https:\\/\\/images.tntdrama.com\\/tnt\\/$dyna_params\\/https%3A%2F%2Fi.cdn.tntdrama.com%2Fassets%2Fimages%2F2018%2F12%2FAngelsInTheInfield-1024x1536_0.jpg', 'type': 'video'}, 'main_1600x900': {'fid': '11015', 'url': 'https:\\/\\/images.tntdrama.com\\/tnt\\/$dyna_params\\/https%3A%2F%2Fi.cdn.tntdrama.com%2Fassets%2Fimages%2F2018%2F12%2FAngelsInTheInfield-default-1600x900.jpg', 'type': 'video'}, 'main_1692x695': {'fid': '11016', 'url': 'https:\\/\\/images.tntdrama.com\\/tnt\\/$dyna_params\\/https%3A%2F%2Fi.cdn.tntdrama.com%2Fassets%2Fimages%2F2018%2F12%2FAngelsInTheOutfield-1692x695.jpg', 'type': 'video'}, 'tvapps_1920xjpg': {'fid': '11014', 'url': 'https:\\/\\/images.tntdrama.com\\/tnt\\/$dyna_params\\/https%3A%2F%2Fi.cdn.tntdrama.com%2Fassets%2Fimages%2F2018%2F12%2FAngelsInTheInfield-Feature-1920x1080_0.jpg', 'type': 'video'}, 'main_2048x1536': {'fid': '11012', 'url': 'https:\\/\\/images.tntdrama.com\\/tnt\\/$dyna_params\\/https%3A%2F%2Fi.cdn.tntdrama.com%2Fassets%2Fimages%2F2018%2F12%2FAngelsInTheOutfield-2048x1536_0.jpg', 'type': 'video'}}"
video,16877,1559750520,,,The Dukes of Hazzard [Uncut],2198245,movie,2198245,NaN,"Hazzard County boasts some of the most axel-busting back roads, hair-raising moonshine, and best-looking farm girls in all of Georgia--and the Duke boys enjoy all three--frequently.","Hazzard County boasts some of the most axel-busting back roads, hair-raising moonshine, and best-looking farm girls in all of Georgia--and the Duke boys enjoy all three--frequently. The Duke's family business is moonshine, and the boys' Uncle Jesse concocts the tastiest brew in Dixie. More often than not, the boys find themselves on the wrong side of the law as they race to make their deliveries, leading the sheriff's department on some truly wild goose chases in their infamous orange Dodge Charger, the General Lee. After a long day on the job, there's nothing like relaxing with an ice cold beer at Hazzard County's finest drinking establishment, The Boar's Nest, where Daisy waits tables. From time to time, an out-of-towner makes the mistake of getting a little too familiar with the most beautiful girl in Hazzard Country. They quickly find out, the hard way, that Daisy isn't just a pretty face--she kicks ass like a Duke; and with Bo and Luke in the mix, that usually means a good old-fashioned knock-down, drag-out bar brawl. But it's not all moonshine and farm girls these days---when Bo and Luke discover evidence that their neighbors' properties are being unlawfully seized by crooked commissioner Boss Hogg, their only chance to protect their hometown is to put the 'pedal to the medal' in a last-ditch scheme to save Hazzard County.","Hazzard County boasts some of the most axel-busting back roads, hair-raising moonshine, and best-looking farm girls in all of Georgia--and the Duke boys enjoy all three--frequently.","Hazzard County boasts some of the most axel-busting back roads, hair-raising moonshine, and best-looking farm girls in all of Georgia--and the Duke boys enjoy all three--frequently. The Duke's family business is moonshine, and the boys' Uncle Jesse concocts the tastiest brew in Dixie. More often than not, the boys find themselves on the wrong side of the law as they race to make their deliveries, leading the sheriff's department on some truly wild goose chases in their infamous orange Dodge Charger, the General Lee. After a long day on the job, there's nothing like relaxing with an ice cold beer at Hazzard County's finest drinking establishment, The Boar's Nest, where Daisy waits tables. From time to time, an out-of-towner makes the mistake of getting a little too familiar with the most beautiful girl in Hazzard Country. They quickly find out, the hard way, that Daisy isn't just a pretty face--she kicks ass like a Duke; and with Bo and Luke in the mix, that usually means a good old-fashioned knock-down, drag-out bar brawl. But it's not all moonshine and farm girls these days---when Bo and Luke discover evidence that their neighbors' properties are being unlawfully seized by crooked commissioner Boss Hogg, their only chance to protect their hometown is to put the 'pedal to the medal' in a last-ditch scheme to save Hazzard County.",,PG-13,False,,,,45bf2e87f08165dbcf68930e76c30e725dcca2da,1,\/movies\/the-dukes-of-hazzard-uncut,https:\/\/www.tntdrama.com\/movies\/the-dukes-of-hazzard-uncut,6247.9751,2005,104 min,10,,,,1,"{'banner': 'NaN', 'rectangle': 'NaN', 'display_presented': True, 'sponsor_120x42': 'NaN', 'mobile_ad': 'NaN', 'display_ad_inventory_id': 'NaN'}",[],Watch On the App,https:\/\/tnt.app.link\/MdMyrvVJc5,1585728000,1587455999,,,Expires April 20,Expires Tomorrow,False,Expires Tomorrow,"{'main_846x700': {'fid': '16577', 'url': 'https:\\/\\/images.tntdrama.com\\/tnt\\/$dyna_params\\/https%3A%2F%2Fi.cdn.tntdrama.com%2Fassets%2Fimages%2F2020%2F03%2FDukes-846x700.jpg', 'type': 'video'}, 'main_1024x1536': {'fid': '16573', 'url': 'https:\\/\\/images.tntdrama.com\\/tnt\\/$dyna_params\\/https%3A%2F%2Fi.cdn.tntdrama.com%2Fassets%2Fimages%2F2020%2F03%2FDukes-1024x1536.jpg', 'type': 'video'}, 'main_1600x900': {'fid': '16575', 'url': 'https:\\/\\/images.tntdrama.com\\/tnt\\/$dyna_params\\/https%3A%2F%2Fi.cdn.tntdrama.com%2Fassets%2Fimages%2F2020%2F03%2FDukes-1600x900.jpg', 'type': 'video'}, 'main_1692x695': {'fid': '16576', 'url': 'https:\\/\\/images.tntdrama.com\\/tnt\\/$dyna_params\\/https%3A%2F%2Fi.cdn.tntdrama.com%2Fassets%2Fimages%2F2020%2F03%2FDukes-1692x695.jpg', 'type': 'video'}, 'tvapps_1920xjpg': {'fid': '16574', 'url': 'https:\\/\\/images.tntdrama.com\\/tnt\\/$dyna_params\\/https%3A%2F%2Fi.cdn.tntdrama.com%2Fassets%2Fimages%2F2020%2F03%2FDukes-1920x1080.jpg', 'type': 'video'}, 'main_2048x1536': {'fid': '16572', 'url': 'https:\\/\\/images.tntdrama.com\\/tnt\\/$dyna_params\\/https%3A%2F%2Fi.cdn.tntdrama.com%2Fassets%2Fimages%2F2020%2F03%2FDukes-2048x1536.jpg', 'type': 'video'}}"
video,7697,1488596401,,,The Wolverine,833648,movie,833648,NaN,"Following the loss of his memory, James Logan (aka Wolverine) journeys to Japan and must decide whether to embrace the code of the samurai.","Following the loss of his memory, James Logan (aka Wolverine) journeys to Japan and must decide whether to embrace the code of the samurai.","Following the loss of his memory, James Logan (aka Wolverine) journeys to Japan and must decide whether to embrace the code of the samurai.","Following the loss of his memory, James Logan (aka Wolverine) journeys to Japan and must decide whether to embrace the code of the samurai.","Following the loss of his memory, James Logan (aka Wolverine) journeys to Japan and must decide whether to embrace the code of the samurai.",PG-13,False,,,,bb6eff29edbc211cd1d46d30ba64547e9fede1e7,1,\/movies\/the-wolverine,https:\/\/www.tntdrama.com\/movies\/the-wolverine,6487.2475,2013,108 min,10,,,,1,"{'banner': 'NaN', 'rectangle': 'NaN', 'display_presented': False, 'sponsor_120x42': 'NaN', 'mobile_ad': 'NaN', 'display_ad_inventory_id': 'NaN'}",[],Watch On the App,https:\/\/tnt.app.link\/EgVmRq15N1,1585728000,1588319999,,,Expires April 30,,False,,"{'main_846x700': {'fid': '14934', 'url': 'https:\\/\\/images.tntdrama.com\\/tnt\\/$dyna_params\\/https%3A%2F%2Fi.cdn.tntdrama.com%2Fassets%2Fimages%2F2019%2F11%2FTheWolverine-846x700.jpg', 'type': 'video'}, 'main_1024x1536': {'fid': '14930', 'url': 'https:\\/\\/images.tntdrama.com\\/tnt\\/$dyna_params\\/https%3A%2F%2Fi.cdn.tntdrama.com%2Fassets%2Fimages%2F2019%2F11%2FTheWolverine-1024x1536.jpg', 'type': 'video'}, 'main_1600x900': {'fid': '14932', 'url': 'https:\\/\\/images.tntdrama.com\\/tnt\\/$dyna_params\\/https%3A%2F%2Fi.cdn.tntdrama.com%2Fassets%2Fimages%2F2019%2F11%2FTheWolverine-1600x900.jpg', 'type': 'video'}, 'main_1692x695': {'fid': '15128', 'url': 'https:\\/\\/images.tntdrama.com\\/tnt\\/$dyna_params\\/https%3A%2F%2Fi.cdn.tntdrama.com%2Fassets%2Fimages%2F2019%2F12%2FWolverineThe-1692x695%2520%25281%2529.jpg', 'type': 'video'}, 'tvapps_1920xjpg': {'fid': '14931', 'url': 'https:\\/\\/images.tntdrama.com\\/tnt\\/$dyna_params\\/https%3A%2F%2Fi.cdn.tntdrama.com%2Fassets%2Fimages%2F2019%2F11%2FTheWolverine-1920x1080.jpg', 'type': 'video'}, 'main_2048x1536': {'fid': '14929', 'url': 'https:\\/\\/images.tntdrama.com\\/tnt\\/$dyna_params\\/https%3A%2F%2Fi.cdn.tntdrama.com%2Fassets%2Fimages%2F2019%2F11%2FTheWolverine-2048x1536.jpg', 'type': 'video'}}"
video,7619,1488595501,,,We're the Millers,909290,movie,909290,NaN,A small-time pot dealer creates a make-believe family and rents an RV in order to smuggle a large shipment of marijuana from Mexico into the United States.  ,"A drug dealer creates a make-believe family in order to bring 1,400 pounds of marijuana into the U.S.",A small-time pot dealer creates a make-believe family and rents an RV in order to smuggle a large shipment of marijuana from Mexico into the United States.  ,"A drug dealer creates a make-believe family in order to bring 1,400 pounds of marijuana into the U.S.",,R,False,,,,d1e40696ac55d4d5b2ed36d8d90afd4ebd615807,1,\/movies\/were-the-millers,https:\/\/www.tntdrama.com\/movies\/were-the-millers,5822.8505,2013,97 min,10,,,,1,"{'banner': 'NaN', 'rectangle': 'NaN', 'display_presented': False, 'sponsor_120x42': 'NaN', 'mobile_ad': 'NaN', 'display_ad_inventory_id': 'NaN'}",[],Watch On the App,https:\/\/tnt.app.link\/r8QrBm890O,1585728000,1588319999,,,Expires April 30,,False,,"{'main_846x700': {'fid': '5700', 'url': 'https:\\/\\/images.tntdrama.com\\/tnt\\/$dyna_params\\/https%3A%2F%2Fi.cdn.tntdrama.com%2Fassets%2Fimages%2F2017%2F09%2FWere_the_Millers_846x700.jpg', 'type': 'video'}, 'main_1024x1536': {'fid': '5739', 'url': 'https:\\/\\/images.tntdrama.com\\/tnt\\/$dyna_params\\/https%3A%2F%2Fi.cdn.tntdrama.com%2Fassets%2Fimages%2F2017%2F09%2FWereTheMillers-1024x1536.jpg', 'type': 'video'}, 'main_1600x900': {'fid': '5698', 'url': 'https:\\/\\/images.tntdrama.com\\/tnt\\/$dyna_params\\/https%3A%2F%2Fi.cdn.tntdrama.com%2Fassets%2Fimages%2F2017%2F09%2Fwere-the-millers-1600x900.jpg', 'type': 'video'}, 'main_1692x695': {'fid': '5699', 'url': 'https:\\/\\/images.tntdrama.com\\/tnt\\/$dyna_params\\/https%3A%2F%2Fi.cdn.tntdrama.com%2Fassets%2Fimages%2F2017%2F09%2FWere_the_Millers_1692x695.jpg', 'type': 'video'}, 'tvapps_1920xjpg': {'fid': '5740', 'url': 'https:\\/\\/images.tntdrama.com\\/tnt\\/$dyna_params\\/https%3A%2F%2Fi.cdn.tntdrama.com%2Fassets%2Fimages%2F2017%2F09%2FWereTheMillers-1920x1080.jpg', 'type': 'video'}, 'main_2048x1536': {'fid': '5738', 'url': 'https:\\/\\/images.tntdrama.com\\/tnt\\/$dyna_params\\/https%3A%2F%2Fi.cdn.tntdrama.com%2Fassets%2Fimages%2F2017%2F09%2FWereTheMillers-2048x1536.jpg', 'type': 'video'}}"
video,16738,1557950520,,,Jurassic Park III [Uncut],2197273,movie,2197273,NaN,"Dr. Alan Grant is persuaded by Paul Kirby and his wife to accompany them on an aerial tour of Isla Sorna. This island, once InGen's site B, has become both a primordial breeding ground for John Hammond's dinosaurs.","Anxious to fund research for his new theory of velociraptor intelligence, renowned paleontologist Dr. Alan Grant is persuaded by wealthy adventurer Paul Kirby and his wife Amanda to accompany them on an aerial tour of Isla Sorna. This infamous island, once InGen's site B, has become both a primordial breeding ground for John Hammond's magnificent creations and a magnet for thrill-seekers eager to encounter them. When a tragic accident maroons the party of seven, Grant discovers the True reason his deceptive hosts have invited him along. In their perilous attempt to escape, the dwindling group encounters terrifying new creatures undisclosed by InGen and Grant is forced to learn the dreadful implications of his raptor intelligence theory firsthand.","Dr. Alan Grant is persuaded by Paul Kirby and his wife to accompany them on an aerial tour of Isla Sorna. This island, once InGen's site B, has become both a primordial breeding ground for John Hammond's dinosaurs.","Anxious to fund research for his new theory of velociraptor intelligence, renowned paleontologist Dr. Alan Grant is persuaded by wealthy adventurer Paul Kirby and his wife Amanda to accompany them on an aerial tour of Isla Sorna. This infamous island, once InGen's site B, has become both a primordial breeding ground for John Hammond's magnificent creations and a magnet for thrill-seekers eager to encounter them. When a tragic accident maroons the party of seven, Grant discovers the True reason his deceptive hosts have invited him along. In their perilous attempt to escape, the dwindling group encounters terrifying new creatures undisclosed by InGen and Grant is forced to learn the dreadful implications of his raptor intelligence theory firsthand.",,PG-13,False,,,,425204ad94398251c44d309f1866dca558934497,1,\/movies\/jurassic-park-iii-uncut,https:\/\/www.tntdrama.com\/movies\/jurassic-park-iii-uncut,5536.0639,2001,92 min,10,,,,1,"{'banner': 'NaN', 'rectangle': 'NaN', 'display_presented': True, 'sponsor_120x42': 'NaN', 'mobile_ad': 'NaN', 'display_ad_inventory_id': 'NaN'}",[],Watch On the App,https:\/\/tnt.app.link\/mAe3whZXs3,1581847200,1587715199,,,Expires April 23,Expires in 4 days,False,Expires in 4 days,"{'main_846x700': {'fid': '10021', 'url': 'https:\\/\\/images.tntdrama.com\\/tnt\\/$dyna_params\\/https%3A%2F%2Fi.cdn.tntdrama.com%2Fassets%2Fimages%2F2018%2F10%2FJurassicParkIII-846x700.jpg', 'type': 'video'}, 'main_1024x1536': {'fid': '10017', 'url': 'https:\\/\\/images.tntdrama.com\\/tnt\\/$dyna_params\\/https%3A%2F%2Fi.cdn.tntdrama.com%2Fassets%2Fimages%2F2018%2F10%2FJurassicParkIII-1024x1536.jpg', 'type': 'video'}, 'main_1600x900': {'fid': '10019', 'url': 'https:\\/\\/images.tntdrama.com\\/tnt\\/$dyna_params\\/https%3A%2F%2Fi.cdn.tntdrama.com%2Fassets%2Fimages%2F2018%2F10%2FJurassicParkIII-1600x900.jpg', 'type': 'video'}, 'main_1692x695': {'fid': '10020', 'url': 'https:\\/\\/images.tntdrama.com\\/tnt\\/$dyna_params\\/https%3A%2F%2Fi.cdn.tntdrama.com%2Fassets%2Fimages%2F2018%2F10%2FJurassicParkIII-1692x695.jpg', 'type': 'video'}, 'tvapps_1920xjpg': {'fid': '10018', 'url': 'https:\\/\\/images.tntdrama.com\\/tnt\\/$dyna_params\\/https%3A%2F%2Fi.cdn.tntdrama.com%2Fassets%2Fimages%2F2018%2F10%2FJurassicParkIII-1920x1080.jpg', 'type': 'video'}, 'main_2048x1536': {'fid': '10016', 'url': 'https:\\/\\/images.tntdrama.com\\/tnt\\/$dyna_params\\/https%3A%2F%2Fi.cdn.tntdrama.com%2Fassets%2Fimages%2F2018%2F10%2FJurassicParkIII-2048x1536.jpg', 'type': 'video'}}"
video,14678,1542823201,,,Norbit [Uncut],2187630,movie,2187630,NaN,"Norbit has never had it easy. As a baby, he was abandoned on the steps of an orphanage. Things get worse when he's forced into marriage by Rasputia. Just when Norbit's hanging by his last thread, his childhood sweetheart moves back to town.","Norbit has never had it easy. As a baby, he was abandoned on the steps of a Chinese restaurant\/orphanage and raised by Mr. Wong. Things get worse when he's forced into marriage by the mean, junk food-chugging queen, Rasputia. Just when Norbit's hanging by his last thread, his childhood sweetheart, Kate, moves back to town.","Norbit has never had it easy. As a baby, he was abandoned on the steps of an orphanage. Things get worse when he's forced into marriage by Rasputia. Just when Norbit's hanging by his last thread, his childhood sweetheart moves back to town.","Norbit has never had it easy. As a baby, he was abandoned on the steps of a Chinese restaurant\/orphanage and raised by Mr. Wong. Things get worse when he's forced into marriage by the mean, junk food-chugging queen, Rasputia. Just when Norbit's hanging by his last thread, his childhood sweetheart, Kate, moves back to town.",,PG-13,False,,,,e04d81c303d856db99d15453b18c3923e372ce33,1,\/movies\/norbit-uncut,https:\/\/www.tntdrama.com\/movies\/norbit-uncut,6134.1946,2007,102 min,10,,,,1,"{'banner': 'NaN', 'rectangle': 'NaN', 'display_presented': True, 'sponsor_120x42': 'NaN', 'mobile_ad': 'NaN', 'display_ad_inventory_id': 'NaN'}",[],Watch On the App,https:\/\/tnt.app.link\/gxsXVYXBK1,1585728000,1588319999,,,Expires April 30,,False,,"{'main_846x700': {'fid': '10287', 'url': 'https:\\/\\/images.tntdrama.com\\/tnt\\/$dyna_params\\/https%3A%2F%2Fi.cdn.tntdrama.com%2Fassets%2Fimages%2F2018%2F10%2FNorbit-846x700.jpg', 'type': 'video'}, 'main_1024x1536': {'fid': '10283', 'url': 'https:\\/\\/images.tntdrama.com\\/tnt\\/$dyna_params\\/https%3A%2F%2Fi.cdn.tntdrama.com%2Fassets%2Fimages%2F2018%2F10%2FNorbit-1024x1536.jpg', 'type': 'video'}, 'main_1600x900': {'fid': '10285', 'url': 'https:\\/\\/images.tntdrama.com\\/tnt\\/$dyna_params\\/https%3A%2F%2Fi.cdn.tntdrama.com%2Fassets%2Fimages%2F2018%2F10%2FNorbit-1600x900.jpg', 'type': 'video'}, 'main_1692x695': {'fid': '10286', 'url': 'https:\\/\\/images.tntdrama.com\\/tnt\\/$dyna_params\\/https%3A%2F%2Fi.cdn.tntdrama.com%2Fassets%2Fimages%2F2018%2F10%2FNorbit-1692x695.jpg', 'type': 'video'}, 'tvapps_1920xjpg': {'fid': '10284', 'url': 'https:\\/\\/images.tntdrama.com\\/tnt\\/$dyna_params\\/https%3A%2F%2Fi.cdn.tntdrama.com%2Fassets%2Fimages%2F2018%2F10%2FNorbit-1920x1080.jpg', 'type': 'video'}, 'main_2048x1536': {'fid': '10282', 'url': 'https:\\/\\/images.tntdrama.com\\/tnt\\/$dyna_params\\/https%3A%2F%2Fi.cdn.tntdrama.com%2Fassets%2Fimages%2F2018%2F10%2FNorbit-2048x1536.jpg', 'type': 'video'}}"
video,16737,1557950520,,,The Lost World: Jurassic Park [Uncut],2197274,movie,2197274,NaN,John Hammond recreated dinosaurs from DNA encased in ember and started a park. But its' systems broke down shortly before it could open and the dinosaurs had to be destroyed. Dr. Ian Malcolm is about to find out something has survived.,"A few years back, venture capitalist John Hammond figured out how to recreate dinosaurs from DNA fragments encased in ember. He started a company called InGen, which placed the genetically engineered dinosaurs in a theme park on an island in Costa Rica. But the Jurassic Park systems broke down shortly before it could open, the dinosaurs got free and had to be destroyed, and the island was closed to the public. In the aftermath, everyone involved moved quickly to quash the story. InGen wanted to limit its liability. The Costa Rican government wanted to preserve its reputation as a tourist paradise. And the individual scientists who had been hired as consultants on the project were bound by the nondisclosure agreement to remain silent. But as Dr. Ian Malcolm is about to find out something has survived.",John Hammond recreated dinosaurs from DNA encased in ember and started a park. But its' systems broke down shortly before it could open and the dinosaurs had to be destroyed. Dr. Ian Malcolm is about to find out something has survived.,"A few years back, venture capitalist John Hammond figured out how to recreate dinosaurs from DNA fragments encased in ember. He started a company called InGen, which placed the genetically engineered dinosaurs in a theme park on an island in Costa Rica. But the Jurassic Park systems broke down shortly before it could open, the dinosaurs got free and had to be destroyed, and the island was closed to the public. In the aftermath, everyone involved moved quickly to quash the story. InGen wanted to limit its liability. The Costa Rican government wanted to preserve its reputation as a tourist paradise. And the individual scientists who had been hired as consultants on the project were bound by the nondisclosure agreement to remain silent. But as Dr. Ian Malcolm is about to find out something has survived.",,PG-13,False,,,,dee55a810f29d72bc8a164e604e910724aef85a9,1,\/movies\/the-lost-world-jurassic-park-uncut,https:\/\/www.tntdrama.com\/movies\/the-lost-world-jurassic-park-uncut,7724.8838,1997,128 min,10,,,,1,"{'banner': 'NaN', 'rectangle': 'NaN', 'display_presented': True, 'sponsor_120x42': 'NaN', 'mobile_ad': 'NaN', 'display_ad_inventory_id': 'NaN'}",[],Watch On the App,https:\/\/tnt.app.link\/Io8McAh4s3,1581847200,1587715199,,,Expires April 23,Expires in 4 days,False,Expires in 4 days,"{'main_846x700': {'fid': '10027', 'url': 'https:\\/\\/images.tntdrama.com\\/tnt\\/$dyna_params\\/https%3A%2F%2Fi.cdn.tntdrama.com%2Fassets%2Fimages%2F2018%2F10%2FLostWorldJurassicPark-846x700.jpg', 'type': 'video'}, 'main_1024x1536': {'fid': '10023', 'url': 'https:\\/\\/images.tntdrama.com\\/tnt\\/$dyna_params\\/https%3A%2F%2Fi.cdn.tntdrama.com%2Fassets%2Fimages%2F2018%2F10%2FLostWorldJurassicPark-1024x1536.jpg', 'type': 'video'}, 'main_1600x900': {'fid': '10025', 'url': 'https:\\/\\/images.tntdrama.com\\/tnt\\/$dyna_params\\/https%3A%2F%2Fi.cdn.tntdrama.com%2Fassets%2Fimages%2F2018%2F10%2FLostWorldJurassicPark-1600x900.jpg', 'type': 'video'}, 'main_1692x695': {'fid': '10026', 'url': 'https:\\/\\/images.tntdrama.com\\/tnt\\/$dyna_params\\/https%3A%2F%2Fi.cdn.tntdrama.com%2Fassets%2Fimages%2F2018%2F10%2FLostWorldJurassicPark-1692x695.jpg', 'type': 'video'}, 'tvapps_1920xjpg': {'fid': '10024', 'url': 'https:\\/\\/images.tntdrama.com\\/tnt\\/$dyna_params\\/https%3A%2F%2Fi.cdn.tntdrama.com%2Fassets%2Fimages%2F2018%2F10%2FLostWorldJurassicPark-1920x1080.jpg', 'type': 'video'}, 'main_2048x1536': {'fid': '10022', 'url': 'https:\\/\\/images.tntdrama.com\\/tnt\\/$dyna_params\\/https%3A%2F%2Fi.cdn.tntdrama.com%2Fassets%2Fimages%2F2018%2F10%2FLostWorldJurassicPark-2048x1536.jpg', 'type': 'video'}}"
