entityType,id,created,teaserType,seriesReference,title,titleId,videoType,videoId,seriesId,shortDescription,description,shortDescriptionNoTags,descriptionNoTags,metaDescription,tvRating,originalPremierDate,originalPremierDateFormatted,season,episode,mediaID,authRequired,url,canonicalUrl,duration,releaseYear,durationFormatted,squeezetime,episodeReference,movieReference,seriesPrimaryCollection,isPlayable,ads,tags,deeplinkTitle,deeplinkUri,startTime,endTime,availableOn,airsOn,expireDateFormatted,expiresOn,newStatus,availabilityInfo,images
video,8498,1492221602,,,Angels in the Outfield,18791,movie,18791,NaN,"A foster child believes his luck will change if the California Angels can win the pennant. The last place team's manager is trying to turn the club around and save his job. He gets help from an angel, who leads the club to the playoffs.","A foster child believes that his luck will change if his beloved California Angels can win the pennant. Meanwhile, the last place team's manager is trying to turn the club around and save his job. He gets help from an angel named Al who miraculously leads the club to the playoffs.","A foster child believes his luck will change if the California Angels can win the pennant. The last place team's manager is trying to turn the club around and save his job. He gets help from an angel, who leads the club to the playoffs.","A foster child believes that his luck will change if his beloved California Angels can win the pennant. Meanwhile, the last place team's manager is trying to turn the club around and save his job. He gets help from an angel named Al who miraculously leads the club to the playoffs.",,PG,False,,,,0318eb4bb41ccfd54f6bb0a13e151ef6039c924f,1,\/movies\/angels-in-the-outfield,https:\/\/www.tntdrama.com\/movies\/angels-in-the-outfield,5447.7757,1994,90 min,10,,,,1,"{'banner': 'NaN', 'rectangle': 'NaN', 'display_presented': False, 'sponsor_120x42': 'NaN', 'mobile_ad': 'NaN', 'display_ad_inventory_id': 'NaN'}",[],Watch On the App,https:\/\/tnt.app.link\/K0GjZTFbBS,1585728000,1588319999,,,Expires April 30,,False,,"{'main_846x700': {'fid': '11008', 'url': 'https:\\/\\/images.tntdrama.com\\/tnt\\/$dyna_params\\/https%3A%2F%2Fi.cdn.tntdrama.com%2Fassets%2Fimages%2F2018%2F12%2FAngels-In-The-Outfield-846x700.jpg', 'type': 'video'}, 'main_1024x1536': {'fid': '11004', 'url': 'https:\\/\\/images.tntdrama.com\\/tnt\\/$dyna_params\\/https%3A%2F%2Fi.cdn.tntdrama.com%2Fassets%2Fimages%2F2018%2F12%2FAngels-In-The-Outfield-1024x1536.jpg', 'type': 'video'}, 'main_1600x900': {'fid': '11006', 'url': 'https:\\/\\/images.tntdrama.com\\/tnt\\/$dyna_params\\/https%3A%2F%2Fi.cdn.tntdrama.com%2Fassets%2Fimages%2F2018%2F12%2FAngels-In-The-Outfield-1600x900.jpg', 'type': 'video'}, 'main_1692x695': {'fid': '11007', 'url': 'https:\\/\\/images.tntdrama.com\\/tnt\\/$dyna_params\\/https%3A%2F%2Fi.cdn.tntdrama.com%2Fassets%2Fimages%2F2018%2F12%2FAngels-In-The-Outfield-1692x695.jpg', 'type': 'video'}, 'tvapps_1920xjpg': {'fid': '11005', 'url': 'https:\\/\\/images.tntdrama.com\\/tnt\\/$dyna_params\\/https%3A%2F%2Fi.cdn.tntdrama.com%2Fassets%2Fimages%2F2018%2F12%2FAngels-In-The-Outfield-1920x1080.jpg', 'type': 'video'}, 'main_2048x1536': {'fid': '11003', 'url': 'https:\\/\\/images.tntdrama.com\\/tnt\\/$dyna_params\\/https%3A%2F%2Fi.cdn.tntdrama.com%2Fassets%2Fimages%2F2018%2F12%2FAngels-In-The-Outfield-2048x1536.jpg', 'type': 'video'}}"
video,17841,1577376120,,,How to Train Your Dragon [Uncut],2216698,movie,2216698,NaN,Hiccup is a Viking teenager who doesn't fit in with his tribe's tradition of dragon slayers. His world is turned upside down when he encounters a dragon that challenges him and the Vikings to see the world from a different point of view.,Hiccup is a Viking teenager who doesn't fit in with his tribe's longstanding tradition of heroic dragon slayers. His world is turned upside down when he encounters a dragon that challenges him and his fellow Vikings to see the world from an entirely different point of view.,Hiccup is a Viking teenager who doesn't fit in with his tribe's tradition of dragon slayers. His world is turned upside down when he encounters a dragon that challenges him and the Vikings to see the world from a different point of view.,Hiccup is a Viking teenager who doesn't fit in with his tribe's longstanding tradition of heroic dragon slayers. His world is turned upside down when he encounters a dragon that challenges him and his fellow Vikings to see the world from an entirely different point of view.,,PG,False,,,,a04096b77b6ff4914ca4e3fe99a5fae7a593d463,1,\/movies\/how-to-train-your-dragon-uncut,https:\/\/www.tntdrama.com\/movies\/how-to-train-your-dragon-uncut,5872.9336,2010,97 min,10,,,,1,"{'banner': 'NaN', 'rectangle': 'NaN', 'display_presented': True, 'sponsor_120x42': 'NaN', 'mobile_ad': 'NaN', 'display_ad_inventory_id': 'NaN'}",[],Watch On the App,https:\/\/tnt.app.link\/tvkj8GTKh5,1585728000,1589615999,,,Expires May 15,,False,,"{'main_846x700': {'fid': '16509', 'url': 'https:\\/\\/images.tntdrama.com\\/tnt\\/$dyna_params\\/https%3A%2F%2Fi.cdn.tntdrama.com%2Fassets%2Fimages%2F2020%2F03%2FHTTYD-846x700.jpg', 'type': 'video'}, 'main_1024x1536': {'fid': '16502', 'url': 'https:\\/\\/images.tntdrama.com\\/tnt\\/$dyna_params\\/https%3A%2F%2Fi.cdn.tntdrama.com%2Fassets%2Fimages%2F2020%2F03%2FHTTYD-1024x1536.jpg', 'type': 'video'}, 'main_1600x900': {'fid': '16507', 'url': 'https:\\/\\/images.tntdrama.com\\/tnt\\/$dyna_params\\/https%3A%2F%2Fi.cdn.tntdrama.com%2Fassets%2Fimages%2F2020%2F03%2FHTTYD-1600x900.jpg', 'type': 'video'}, 'main_1692x695': {'fid': '16508', 'url': 'https:\\/\\/images.tntdrama.com\\/tnt\\/$dyna_params\\/https%3A%2F%2Fi.cdn.tntdrama.com%2Fassets%2Fimages%2F2020%2F03%2FHTTYD-1692x695.jpg', 'type': 'video'}, 'tvapps_1920xjpg': {'fid': '16504', 'url': 'https:\\/\\/images.tntdrama.com\\/tnt\\/$dyna_params\\/https%3A%2F%2Fi.cdn.tntdrama.com%2Fassets%2Fimages%2F2020%2F03%2FHTTYD-1920x1080.jpg', 'type': 'video'}, 'main_2048x1536': {'fid': '16500', 'url': 'https:\\/\\/images.tntdrama.com\\/tnt\\/$dyna_params\\/https%3A%2F%2Fi.cdn.tntdrama.com%2Fassets%2Fimages%2F2020%2F03%2FHTTYD-2048x1536.jpg', 'type': 'video'}}"
video,8150,1488849302,,,Maleficent,892171,movie,892171,NaN,Maleficent has an idyllic life growing up in a forest kingdom until an invading army threatens the harmony. Maleficent rises to be the land's fiercest protector but she suffers a betrayal that begins to turn her pure heart to stone.,"A beautiful, pure-hearted young woman, Maleficent has an idyllic life growing up in a peaceable forest kingdom, until an invading army threatens the harmony of the land. Maleficent rises to be the land's fiercest protector, but she ultimately suffers a ruthless betrayal-an act that begins to turn her pure heart to stone. Bent on revenge, Maleficent faces an epic battle with the invading king's successor and, as a result, places a curse upon his newborn infant Aurora. As the child grows, Maleficent realizes that Aurora holds the key to peace in the kingdom-and perhaps to Maleficent's True happiness as well.",Maleficent has an idyllic life growing up in a forest kingdom until an invading army threatens the harmony. Maleficent rises to be the land's fiercest protector but she suffers a betrayal that begins to turn her pure heart to stone.,"A beautiful, pure-hearted young woman, Maleficent has an idyllic life growing up in a peaceable forest kingdom, until an invading army threatens the harmony of the land. Maleficent rises to be the land's fiercest protector, but she ultimately suffers a ruthless betrayal-an act that begins to turn her pure heart to stone. Bent on revenge, Maleficent faces an epic battle with the invading king's successor and, as a result, places a curse upon his newborn infant Aurora. As the child grows, Maleficent realizes that Aurora holds the key to peace in the kingdom-and perhaps to Maleficent's True happiness as well.",,PG,False,,,,6822abe4716cbf5afd1f0dcd6b8bd627547d0397,1,\/movies\/maleficent,https:\/\/www.tntdrama.com\/movies\/maleficent,4804.6666,2014,80 min,10,,,,1,"{'banner': 'NaN', 'rectangle': 'NaN', 'display_presented': False, 'sponsor_120x42': 'NaN', 'mobile_ad': 'NaN', 'display_ad_inventory_id': 'NaN'}",[],Watch On the App,https:\/\/tnt.app.link\/Te7RIDSRr0,1586246400,1588924799,,,Expires May 7,,False,,"{'main_846x700': {'fid': '5760', 'url': 'https:\\/\\/images.tntdrama.com\\/tnt\\/$dyna_params\\/https%3A%2F%2Fi.cdn.tntdrama.com%2Fassets%2Fimages%2F2017%2F09%2FMaleficent-846x700.jpg', 'type': 'video'}, 'main_1024x1536': {'fid': '5756', 'url': 'https:\\/\\/images.tntdrama.com\\/tnt\\/$dyna_params\\/https%3A%2F%2Fi.cdn.tntdrama.com%2Fassets%2Fimages%2F2017%2F09%2FMaleficent-1024x1536.jpg', 'type': 'video'}, 'main_1600x900': {'fid': '5758', 'url': 'https:\\/\\/images.tntdrama.com\\/tnt\\/$dyna_params\\/https%3A%2F%2Fi.cdn.tntdrama.com%2Fassets%2Fimages%2F2017%2F09%2FMaleficent-1600x900.jpg', 'type': 'video'}, 'main_1692x695': {'fid': '5759', 'url': 'https:\\/\\/images.tntdrama.com\\/tnt\\/$dyna_params\\/https%3A%2F%2Fi.cdn.tntdrama.com%2Fassets%2Fimages%2F2017%2F09%2FMaleficent-1692x695.jpg', 'type': 'video'}, 'tvapps_1920xjpg': {'fid': '5757', 'url': 'https:\\/\\/images.tntdrama.com\\/tnt\\/$dyna_params\\/https%3A%2F%2Fi.cdn.tntdrama.com%2Fassets%2Fimages%2F2017%2F09%2FMaleficent-1920x1080.jpg', 'type': 'video'}, 'main_2048x1536': {'fid': '5755', 'url': 'https:\\/\\/images.tntdrama.com\\/tnt\\/$dyna_params\\/https%3A%2F%2Fi.cdn.tntdrama.com%2Fassets%2Fimages%2F2017%2F09%2FMaleficent-2048x1536.jpg', 'type': 'video'}}"
video,14912,1546884120,,,Non-Stop [Uncut],2189790,movie,2189790,NaN,"Bill Marks is a burned-out veteran of the Air Marshals service. He views the assignment not as a life-saving duty, but as a desk job in the sky. However, today's flight will be no routine trip.","Bill Marks is a burned-out veteran of the Air Marshals service. He views the assignment not as a life-saving duty, but as a desk job in the sky. However, today's flight will be no routine trip. Shortly into the transatlantic journey from New York to London, he receives a series of mysterious text messages ordering him to have the government transfer $150 million into a secret account, or a passenger will die very 20 minutes. What follows is cat and mouse game played at 40,000 feet, with the lives of 200 passengers hanging in the balance.","Bill Marks is a burned-out veteran of the Air Marshals service. He views the assignment not as a life-saving duty, but as a desk job in the sky. However, today's flight will be no routine trip.","Bill Marks is a burned-out veteran of the Air Marshals service. He views the assignment not as a life-saving duty, but as a desk job in the sky. However, today's flight will be no routine trip. Shortly into the transatlantic journey from New York to London, he receives a series of mysterious text messages ordering him to have the government transfer $150 million into a secret account, or a passenger will die very 20 minutes. What follows is cat and mouse game played at 40,000 feet, with the lives of 200 passengers hanging in the balance.","A U.S. Air Marshal (Liam Neeson) engages in a cat-and-mouse game at 40,000 feet after getting a series of texts saying a passenger will die every 20 minutes if a ransom isn't paid.",PG-13,False,,,,debc7c3b5f2b2369d9bda2f70962a5ab0c63dff5,1,\/movies\/non-stop-uncut,https:\/\/www.tntdrama.com\/movies\/non-stop-uncut,6400.9613,2014,106 min,10,,,,1,"{'banner': 'NaN', 'rectangle': 'NaN', 'display_presented': True, 'sponsor_120x42': 'NaN', 'mobile_ad': 'NaN', 'display_ad_inventory_id': 'NaN'}",[],Watch On the App,https:\/\/tnt.app.link\/oe7rdhmCj5,1587110400,1592294367,,,Expires June 15,,True,New,"{'main_846x700': {'fid': '16565', 'url': 'https:\\/\\/images.tntdrama.com\\/tnt\\/$dyna_params\\/https%3A%2F%2Fi.cdn.tntdrama.com%2Fassets%2Fimages%2F2020%2F03%2FNonStop-846x700.jpg', 'type': 'video'}, 'main_1024x1536': {'fid': '16561', 'url': 'https:\\/\\/images.tntdrama.com\\/tnt\\/$dyna_params\\/https%3A%2F%2Fi.cdn.tntdrama.com%2Fassets%2Fimages%2F2020%2F03%2FNonStop-1024x1536.jpg', 'type': 'video'}, 'main_1600x900': {'fid': '16563', 'url': 'https:\\/\\/images.tntdrama.com\\/tnt\\/$dyna_params\\/https%3A%2F%2Fi.cdn.tntdrama.com%2Fassets%2Fimages%2F2020%2F03%2FNonStop-1600x900.jpg', 'type': 'video'}, 'main_1692x695': {'fid': '16564', 'url': 'https:\\/\\/images.tntdrama.com\\/tnt\\/$dyna_params\\/https%3A%2F%2Fi.cdn.tntdrama.com%2Fassets%2Fimages%2F2020%2F03%2FNonStop-1692x695.jpg', 'type': 'video'}, 'tvapps_1920xjpg': {'fid': '16562', 'url': 'https:\\/\\/images.tntdrama.com\\/tnt\\/$dyna_params\\/https%3A%2F%2Fi.cdn.tntdrama.com%2Fassets%2Fimages%2F2020%2F03%2FNonStop-1920x1080.jpg', 'type': 'video'}, 'main_2048x1536': {'fid': '16560', 'url': 'https:\\/\\/images.tntdrama.com\\/tnt\\/$dyna_params\\/https%3A%2F%2Fi.cdn.tntdrama.com%2Fassets%2Fimages%2F2020%2F03%2FNonStop-2048x1536.jpg', 'type': 'video'}}"
video,5425,1481656329,,,Race to Witch Mountain,736305,movie,736305,NaN,"For years, stories have circulated about a secret place in the middle of the Nevada desert, known for unexplained phenomena and strange sightings. It is called Witch Mountain.","<p>For years, stories have circulated about a secret place in the middle of the Nevada desert, known for unexplained phenomena and strange sightings. It is called Witch Mountain, and when a Las Vegas cab driver finds two teens with supernatural powers in his cab, he suddenly finds himself in the middle of an adventure he can't explain. When they discover that the only chance to save the world lies in unraveling the secrets of Witch Mountain, the race begins, as the government, mobsters and even extraterrestrials try to stop them.<\/p>
","For years, stories have circulated about a secret place in the middle of the Nevada desert, known for unexplained phenomena and strange sightings. It is called Witch Mountain.","For years, stories have circulated about a secret place in the middle of the Nevada desert, known for unexplained phenomena and strange sightings. It is called Witch Mountain, and when a Las Vegas cab driver finds two teens with supernatural powers in his cab, he suddenly finds himself in the middle of an adventure he can't explain. When they discover that the only chance to save the world lies in unraveling the secrets of Witch Mountain, the race begins, as the government, mobsters and even extraterrestrials try to stop them.  ",,PG,False,,,,e5fcc106157fd11a0ce18a92528081f7d63dcb48,1,\/movies\/race-to-witch-mountain,https:\/\/www.tntdrama.com\/movies\/race-to-witch-mountain,5166.161,2009,86 min,10,,,,1,"{'banner': 'NaN', 'rectangle': 'NaN', 'display_presented': False, 'sponsor_120x42': 'NaN', 'mobile_ad': 'NaN', 'display_ad_inventory_id': 'NaN'}",[],Watch On the App,https:\/\/tnt.app.link\/dXRH43eEgY,1586419200,1589097599,,,Expires May 9,,False,,"{'main_846x700': {'fid': '13313', 'url': 'https:\\/\\/images.tntdrama.com\\/tnt\\/$dyna_params\\/https%3A%2F%2Fi.cdn.tntdrama.com%2Fassets%2Fimages%2F2019%2F07%2FRaceToWitchMountain-846x700.jpg', 'type': 'video'}, 'main_1024x1536': {'fid': '13309', 'url': 'https:\\/\\/images.tntdrama.com\\/tnt\\/$dyna_params\\/https%3A%2F%2Fi.cdn.tntdrama.com%2Fassets%2Fimages%2F2019%2F07%2FRaceToWitchMountain-1024x1536.jpg', 'type': 'video'}, 'main_1600x900': {'fid': '13311', 'url': 'https:\\/\\/images.tntdrama.com\\/tnt\\/$dyna_params\\/https%3A%2F%2Fi.cdn.tntdrama.com%2Fassets%2Fimages%2F2019%2F07%2FRaceToWitchMountain-1600x900.jpg', 'type': 'video'}, 'main_1692x695': {'fid': '13312', 'url': 'https:\\/\\/images.tntdrama.com\\/tnt\\/$dyna_params\\/https%3A%2F%2Fi.cdn.tntdrama.com%2Fassets%2Fimages%2F2019%2F07%2FRaceToWitchMountain-1692x695.jpg', 'type': 'video'}, 'tvapps_1920xjpg': {'fid': '13310', 'url': 'https:\\/\\/images.tntdrama.com\\/tnt\\/$dyna_params\\/https%3A%2F%2Fi.cdn.tntdrama.com%2Fassets%2Fimages%2F2019%2F07%2FRaceToWitchMountain-1920x1080.jpg', 'type': 'video'}, 'main_2048x1536': {'fid': '13308', 'url': 'https:\\/\\/images.tntdrama.com\\/tnt\\/$dyna_params\\/https%3A%2F%2Fi.cdn.tntdrama.com%2Fassets%2Fimages%2F2019%2F07%2FRaceToWitchMountain-2048x1536.jpg', 'type': 'video'}}"
video,1821,1480438975,,,Inception,774971,movie,774971,NaN,"Dom Cobb is a skilled thief, the absolute best in the dangerous art of extraction, stealing valuable secrets from deep within the subconscious during the dream state when the mind is at its most vulnerable.","<p>In a world where technology exists to enter the human mind through dream invasion, a highly skilled thief is given a final chance at redemption which involves executing his toughest job to date: Inception.<\/p>
","Dom Cobb is a skilled thief, the absolute best in the dangerous art of extraction, stealing valuable secrets from deep within the subconscious during the dream state when the mind is at its most vulnerable.","In a world where technology exists to enter the human mind through dream invasion, a highly skilled thief is given a final chance at redemption which involves executing his toughest job to date: Inception.  ",,PG-13,False,,,,18342589e5a4d868d42ec2cc0b518c15b2e40991,1,\/movies\/inception,https:\/\/www.tntdrama.com\/movies\/inception,8824.8495,2010,147 min,10,,,,1,"{'banner': 'NaN', 'rectangle': 'NaN', 'display_presented': False, 'sponsor_120x42': 'NaN', 'mobile_ad': 'NaN', 'display_ad_inventory_id': 'NaN'}",[],Watch On the App,https:\/\/tnt.app.link\/60FrY3wOh5,1585728000,1593590399,,,Expires June 30,,False,,"{'main_846x700': {'fid': '16516', 'url': 'https:\\/\\/images.tntdrama.com\\/tnt\\/$dyna_params\\/https%3A%2F%2Fi.cdn.tntdrama.com%2Fassets%2Fimages%2F2020%2F03%2FInception-846x700.jpg', 'type': 'video'}, 'main_1024x1536': {'fid': '16512', 'url': 'https:\\/\\/images.tntdrama.com\\/tnt\\/$dyna_params\\/https%3A%2F%2Fi.cdn.tntdrama.com%2Fassets%2Fimages%2F2020%2F03%2FInception-1024x1536.jpg', 'type': 'video'}, 'main_1600x900': {'fid': '16514', 'url': 'https:\\/\\/images.tntdrama.com\\/tnt\\/$dyna_params\\/https%3A%2F%2Fi.cdn.tntdrama.com%2Fassets%2Fimages%2F2020%2F03%2FInception-1600x900.jpg', 'type': 'video'}, 'main_1692x695': {'fid': '16515', 'url': 'https:\\/\\/images.tntdrama.com\\/tnt\\/$dyna_params\\/https%3A%2F%2Fi.cdn.tntdrama.com%2Fassets%2Fimages%2F2020%2F03%2FInception-1692x695.jpg', 'type': 'video'}, 'tvapps_1920xjpg': {'fid': '16513', 'url': 'https:\\/\\/images.tntdrama.com\\/tnt\\/$dyna_params\\/https%3A%2F%2Fi.cdn.tntdrama.com%2Fassets%2Fimages%2F2020%2F03%2FInception-1920x1080.jpg', 'type': 'video'}, 'main_2048x1536': {'fid': '16511', 'url': 'https:\\/\\/images.tntdrama.com\\/tnt\\/$dyna_params\\/https%3A%2F%2Fi.cdn.tntdrama.com%2Fassets%2Fimages%2F2020%2F03%2FInception-2048x1536.jpg', 'type': 'video'}}"
video,16667,1556222520,,,Game Night [Uncut],2196396,movie,2196396,NaN,A murder mystery party turns into a wild and chaotic night for a group of unsuspecting couples.,"Max and Annie's weekly game night gets kicked up a notch when Max's brother Brooks arranges a murder mystery party -- complete with fake thugs and federal agents. So when Brooks gets kidnapped, it's all supposed to be part of the game. As the competitors set out to solve the case, they start to learn that neither the game nor Brooks are what they seem to be. The friends soon find themselves in over their heads as each twist leads to another unexpected turn over the course of one chaotic night.",A murder mystery party turns into a wild and chaotic night for a group of unsuspecting couples.,"Max and Annie's weekly game night gets kicked up a notch when Max's brother Brooks arranges a murder mystery party -- complete with fake thugs and federal agents. So when Brooks gets kidnapped, it's all supposed to be part of the game. As the competitors set out to solve the case, they start to learn that neither the game nor Brooks are what they seem to be. The friends soon find themselves in over their heads as each twist leads to another unexpected turn over the course of one chaotic night.",,R,False,,,,afe46d5fade41317e7a4c0bebbc2015b8453dceb,1,\/movies\/game-night-uncut,https:\/\/www.tntdrama.com\/movies\/game-night-uncut,6013.5742,2018,100 min,10,,,,1,"{'banner': 'NaN', 'rectangle': 'NaN', 'display_presented': True, 'sponsor_120x42': 'NaN', 'mobile_ad': 'NaN', 'display_ad_inventory_id': 'NaN'}",[],Watch On the App,https:\/\/tnt.app.link\/6EqsuhTyc5,1585987200,1588665599,,,Expires May 4,,False,,"{'main_846x700': {'fid': '16547', 'url': 'https:\\/\\/images.tntdrama.com\\/tnt\\/$dyna_params\\/https%3A%2F%2Fi.cdn.tntdrama.com%2Fassets%2Fimages%2F2020%2F03%2FGameNight-846x700.jpg', 'type': 'video'}, 'main_1024x1536': {'fid': '16543', 'url': 'https:\\/\\/images.tntdrama.com\\/tnt\\/$dyna_params\\/https%3A%2F%2Fi.cdn.tntdrama.com%2Fassets%2Fimages%2F2020%2F03%2FGameNight-1024x1536.jpg', 'type': 'video'}, 'main_1600x900': {'fid': '16545', 'url': 'https:\\/\\/images.tntdrama.com\\/tnt\\/$dyna_params\\/https%3A%2F%2Fi.cdn.tntdrama.com%2Fassets%2Fimages%2F2020%2F03%2FGameNight-1600x900.jpg', 'type': 'video'}, 'main_1692x695': {'fid': '16546', 'url': 'https:\\/\\/images.tntdrama.com\\/tnt\\/$dyna_params\\/https%3A%2F%2Fi.cdn.tntdrama.com%2Fassets%2Fimages%2F2020%2F03%2FGameNight-1692x695.jpg', 'type': 'video'}, 'tvapps_1920xjpg': {'fid': '16544', 'url': 'https:\\/\\/images.tntdrama.com\\/tnt\\/$dyna_params\\/https%3A%2F%2Fi.cdn.tntdrama.com%2Fassets%2Fimages%2F2020%2F03%2FGameNight-1920x1080.jpg', 'type': 'video'}, 'main_2048x1536': {'fid': '16542', 'url': 'https:\\/\\/images.tntdrama.com\\/tnt\\/$dyna_params\\/https%3A%2F%2Fi.cdn.tntdrama.com%2Fassets%2Fimages%2F2020%2F03%2FGameNight-2048x1536.jpg', 'type': 'video'}}"
video,5655,1481656480,,,Ransom,300927,movie,300927,NaN,A self-made millionaire stuns his wife and the FBI with a televised threat to his son's kidnappers.,"Tom Mullen is a wealthy corporate executive used to mediating tough business deals, and doing things his own way. Along with his beautiful wife Kate and son Sean, Tom has all the material trappings of success, including a Fifth Avenue penthouse, an enviable position in New York society and high media visibility. But when the thing he cherishes most--his young son--is abducted by desperate criminals and held for ransom, Tom's world of affluence and privilege comes crashing down. And after an FBI rescue operation fails, he engineers a dangerous countermeasure in a last chance effort to bring his boy back to safety. With his son's life hanging precariously in the balance, and his wife terrified by the shocking plan, Tom offers an appalling proposal, the response to which could easily result in the loss of his son forever.",A self-made millionaire stuns his wife and the FBI with a televised threat to his son's kidnappers.,"Tom Mullen is a wealthy corporate executive used to mediating tough business deals, and doing things his own way. Along with his beautiful wife Kate and son Sean, Tom has all the material trappings of success, including a Fifth Avenue penthouse, an enviable position in New York society and high media visibility. But when the thing he cherishes most--his young son--is abducted by desperate criminals and held for ransom, Tom's world of affluence and privilege comes crashing down. And after an FBI rescue operation fails, he engineers a dangerous countermeasure in a last chance effort to bring his boy back to safety. With his son's life hanging precariously in the balance, and his wife terrified by the shocking plan, Tom offers an appalling proposal, the response to which could easily result in the loss of his son forever.",,R,False,,,,26fcffb269ff96ef1f457bebbce51cc3fd873098,1,\/movies\/ransom-0,https:\/\/www.tntdrama.com\/movies\/ransom-0,6703.0964,1996,111 min,10,,,,1,"{'banner': 'NaN', 'rectangle': 'NaN', 'display_presented': False, 'sponsor_120x42': 'NaN', 'mobile_ad': 'NaN', 'display_ad_inventory_id': 'NaN'}",[],Watch On the App,https:\/\/tnt.app.link\/bWQ1Q6RxEQ,1585728000,1588319999,,,Expires April 30,,False,,"{'main_846x700': {'fid': '9734', 'url': 'https:\\/\\/images.tntdrama.com\\/tnt\\/$dyna_params\\/https%3A%2F%2Fi.cdn.tntdrama.com%2Fassets%2Fimages%2F2018%2F10%2FRansom_846x700.jpg', 'type': 'video'}, 'main_1024x1536': {'fid': '9729', 'url': 'https:\\/\\/images.tntdrama.com\\/tnt\\/$dyna_params\\/https%3A%2F%2Fi.cdn.tntdrama.com%2Fassets%2Fimages%2F2018%2F10%2FRansom_1024x1536.jpg', 'type': 'video'}, 'main_1600x900': {'fid': '9732', 'url': 'https:\\/\\/images.tntdrama.com\\/tnt\\/$dyna_params\\/https%3A%2F%2Fi.cdn.tntdrama.com%2Fassets%2Fimages%2F2018%2F10%2FRansom_1600x900.jpg', 'type': 'video'}, 'main_1692x695': {'fid': '9733', 'url': 'https:\\/\\/images.tntdrama.com\\/tnt\\/$dyna_params\\/https%3A%2F%2Fi.cdn.tntdrama.com%2Fassets%2Fimages%2F2018%2F10%2FRansom_1692x695.jpg', 'type': 'video'}, 'tvapps_1920xjpg': {'fid': '9731', 'url': 'https:\\/\\/images.tntdrama.com\\/tnt\\/$dyna_params\\/https%3A%2F%2Fi.cdn.tntdrama.com%2Fassets%2Fimages%2F2018%2F10%2FRansom_1920x1080.jpg', 'type': 'video'}, 'main_2048x1536': {'fid': '9730', 'url': 'https:\\/\\/images.tntdrama.com\\/tnt\\/$dyna_params\\/https%3A%2F%2Fi.cdn.tntdrama.com%2Fassets%2Fimages%2F2018%2F10%2FRansom_2048x1536_0.jpg', 'type': 'video'}}"
