entityType,id,created,teaserType,seriesReference,title,titleId,videoType,videoId,seriesId,shortDescription,description,shortDescriptionNoTags,descriptionNoTags,metaDescription,tvRating,originalPremierDate,originalPremierDateFormatted,season,episode,mediaID,authRequired,url,canonicalUrl,duration,releaseYear,durationFormatted,squeezetime,episodeReference,movieReference,seriesPrimaryCollection,isPlayable,ads,tags,deeplinkTitle,deeplinkUri,startTime,endTime,availableOn,airsOn,expireDateFormatted,expiresOn,newStatus,availabilityInfo,images
video,15178,1549569720,,,Stronger [Uncut],2192496,movie,2192496,NaN,Jeff Bauman embarks on a heroic journey after losing his legs in the Boston Marathon bombings.,"Jeff Bauman loses both of his legs when two bombs explode during the Boston Marathon on April 15, 2013. After regaining consciousness in the hospital, Jeff is able to help law enforcement identify one of the suspects, but his own battle is just beginning. With unwavering support from his family and girlfriend, Bauman embarks on a long and heroic journey to physical and emotional rehabilitation.",Jeff Bauman embarks on a heroic journey after losing his legs in the Boston Marathon bombings.,"Jeff Bauman loses both of his legs when two bombs explode during the Boston Marathon on April 15, 2013. After regaining consciousness in the hospital, Jeff is able to help law enforcement identify one of the suspects, but his own battle is just beginning. With unwavering support from his family and girlfriend, Bauman embarks on a long and heroic journey to physical and emotional rehabilitation.",,R,False,,,,bfc6c3c18dff46c284d0db46bb1806d70c48a2c9,1,\/movies\/stronger-uncut,https:\/\/www.tntdrama.com\/movies\/stronger-uncut,7142.5021,2017,119 min,10,,,,1,"{'banner': 'NaN', 'rectangle': 'NaN', 'display_presented': True, 'sponsor_120x42': 'NaN', 'mobile_ad': 'NaN', 'display_ad_inventory_id': 'NaN'}",[],Watch On the App,https:\/\/tnt.app.link\/PoQrTBxdx4,1584259200,1589615985,,,Expires May 15,,False,,"{'main_846x700': {'fid': '16228', 'url': 'https:\\/\\/images.tntdrama.com\\/tnt\\/$dyna_params\\/https%3A%2F%2Fi.cdn.tntdrama.com%2Fassets%2Fimages%2F2020%2F03%2FStronger-846x700.jpg', 'type': 'video'}, 'main_1024x1536': {'fid': '16276', 'url': 'https:\\/\\/images.tntdrama.com\\/tnt\\/$dyna_params\\/https%3A%2F%2Fi.cdn.tntdrama.com%2Fassets%2Fimages%2F2020%2F03%2FStronger-1024x1536_0.jpg', 'type': 'video'}, 'main_1600x900': {'fid': '16226', 'url': 'https:\\/\\/images.tntdrama.com\\/tnt\\/$dyna_params\\/https%3A%2F%2Fi.cdn.tntdrama.com%2Fassets%2Fimages%2F2020%2F03%2FStronger-1600x900.jpg', 'type': 'video'}, 'main_1692x695': {'fid': '16227', 'url': 'https:\\/\\/images.tntdrama.com\\/tnt\\/$dyna_params\\/https%3A%2F%2Fi.cdn.tntdrama.com%2Fassets%2Fimages%2F2020%2F03%2FStronger-1692x695.jpg', 'type': 'video'}, 'tvapps_1920xjpg': {'fid': '16225', 'url': 'https:\\/\\/images.tntdrama.com\\/tnt\\/$dyna_params\\/https%3A%2F%2Fi.cdn.tntdrama.com%2Fassets%2Fimages%2F2020%2F03%2FStronger-1920x1080.jpg', 'type': 'video'}, 'main_2048x1536': {'fid': '16223', 'url': 'https:\\/\\/images.tntdrama.com\\/tnt\\/$dyna_params\\/https%3A%2F%2Fi.cdn.tntdrama.com%2Fassets%2Fimages%2F2020%2F03%2FStronger-2048x1536.jpg', 'type': 'video'}}"
video,5125,1481656039,,,Life As We Know It,778489,movie,778489,NaN,"Holly Berenson is an up-and-coming caterer and Eric Messer is a promising network sports director. After a disastrous first date, the only thing they have in common is their dislike for each other.","<p>After a disastrous first date, the only thing Holly Berenson and Eric Messer have in common is their dislike for each other and their love for their goddaughter, Sophie. When they become all Sophie has in the world, Holly and Eric are forced to put their differences aside.<\/p>
","Holly Berenson is an up-and-coming caterer and Eric Messer is a promising network sports director. After a disastrous first date, the only thing they have in common is their dislike for each other.","After a disastrous first date, the only thing Holly Berenson and Eric Messer have in common is their dislike for each other and their love for their goddaughter, Sophie. When they become all Sophie has in the world, Holly and Eric are forced to put their differences aside.  ",,PG-13,False,,,,9e78c20fcc09a9988c91f5df7e1db3d9b3e0e665,1,\/movies\/life-as-we-know-it,https:\/\/www.tntdrama.com\/movies\/life-as-we-know-it,6127.3212,2010,102 min,10,,,,1,"{'banner': 'NaN', 'rectangle': 'NaN', 'display_presented': False, 'sponsor_120x42': 'NaN', 'mobile_ad': 'NaN', 'display_ad_inventory_id': 'NaN'}",[],Watch On the App,https:\/\/tnt.app.link\/Cf57KaUQh5,1585728000,1588319999,,,Expires April 30,,False,,"{'main_846x700': {'fid': '3919', 'url': 'https:\\/\\/images.tntdrama.com\\/tnt\\/$dyna_params\\/https%3A%2F%2Fi.cdn.tntdrama.com%2Fassets%2Fimages%2F2017%2F04%2Flife_as_we_know_it-846x700_080120160233.jpg', 'type': 'video'}, 'main_1024x1536': {'fid': '16518', 'url': 'https:\\/\\/images.tntdrama.com\\/tnt\\/$dyna_params\\/https%3A%2F%2Fi.cdn.tntdrama.com%2Fassets%2Fimages%2F2020%2F03%2FLifeAsWeKnowIt-1024x1536.jpg', 'type': 'video'}, 'main_1600x900': {'fid': '3917', 'url': 'https:\\/\\/images.tntdrama.com\\/tnt\\/$dyna_params\\/https%3A%2F%2Fi.cdn.tntdrama.com%2Fassets%2Fimages%2F2017%2F04%2Flifeasweknowit-1600x900_031320151133.jpg', 'type': 'video'}, 'main_1692x695': {'fid': '3918', 'url': 'https:\\/\\/images.tntdrama.com\\/tnt\\/$dyna_params\\/https%3A%2F%2Fi.cdn.tntdrama.com%2Fassets%2Fimages%2F2017%2F04%2Flife_as_we_know_it-1692x695_080120160232.jpg', 'type': 'video'}, 'tvapps_1920xjpg': {'fid': '16519', 'url': 'https:\\/\\/images.tntdrama.com\\/tnt\\/$dyna_params\\/https%3A%2F%2Fi.cdn.tntdrama.com%2Fassets%2Fimages%2F2020%2F03%2FLifeAsWeKnowIt-1920x1080.jpg', 'type': 'video'}, 'main_2048x1536': {'fid': '16517', 'url': 'https:\\/\\/images.tntdrama.com\\/tnt\\/$dyna_params\\/https%3A%2F%2Fi.cdn.tntdrama.com%2Fassets%2Fimages%2F2020%2F03%2FLifeAsWeKnowIt-2048x1536.jpg', 'type': 'video'}}"
video,14653,1542232802,,,Disturbia [Uncut],2187381,movie,2187381,NaN,"Under house arrest, a troubled youth is unsure if his neighbor is really a serial killer or if his suspicions are the result of a captive and overactive imagination.","Ever since his father died, young Kale has become increasingly sullen and withdrawn, until he finds himself under house arrest. With cabin fever setting in, he turns his attention to spying on his neighbors, becoming increasingly suspicious that one of them is a serial killer. However, he wonders if he is right, or if his overactive imagination is getting the better of him.","Under house arrest, a troubled youth is unsure if his neighbor is really a serial killer or if his suspicions are the result of a captive and overactive imagination.","Ever since his father died, young Kale has become increasingly sullen and withdrawn, until he finds himself under house arrest. With cabin fever setting in, he turns his attention to spying on his neighbors, becoming increasingly suspicious that one of them is a serial killer. However, he wonders if he is right, or if his overactive imagination is getting the better of him.",,PG-13,False,,,,d6ef003fc8953c84f48e3968239fa91f822c9c26,1,\/movies\/disturbia-uncut,https:\/\/www.tntdrama.com\/movies\/disturbia-uncut,6287.0474,2007,104 min,10,,,,1,"{'banner': 'NaN', 'rectangle': 'NaN', 'display_presented': True, 'sponsor_120x42': 'NaN', 'mobile_ad': 'NaN', 'display_ad_inventory_id': 'NaN'}",[],,,1585728000,1588319951,,,Expires April 30,,False,,"{'main_846x700': {'fid': '1286', 'url': 'https:\\/\\/images.tntdrama.com\\/tnt\\/$dyna_params\\/https%3A%2F%2Fi.cdn.tntdrama.com%2Fassets%2Fimages%2F2017%2F04%2FDisturbia_846x700.jpg', 'type': 'video'}, 'main_1024x1536': {'fid': '1283', 'url': 'https:\\/\\/images.tntdrama.com\\/tnt\\/$dyna_params\\/https%3A%2F%2Fi.cdn.tntdrama.com%2Fassets%2Fimages%2F2017%2F04%2FDisturbia-1024x1536.jpg', 'type': 'video'}, 'main_1600x900': {'fid': '1284', 'url': 'https:\\/\\/images.tntdrama.com\\/tnt\\/$dyna_params\\/https%3A%2F%2Fi.cdn.tntdrama.com%2Fassets%2Fimages%2F2017%2F04%2FDisturbia_1600x900.jpg', 'type': 'video'}, 'main_1692x695': {'fid': '1285', 'url': 'https:\\/\\/images.tntdrama.com\\/tnt\\/$dyna_params\\/https%3A%2F%2Fi.cdn.tntdrama.com%2Fassets%2Fimages%2F2017%2F04%2FDisturbia_1692x695.jpg', 'type': 'video'}, 'tvapps_1920xjpg': {'fid': '5109', 'url': 'https:\\/\\/images.tntdrama.com\\/tnt\\/$dyna_params\\/https%3A%2F%2Fi.cdn.tntdrama.com%2Fassets%2Fimages%2F2017%2F07%2FDisturbia-1920x1080.jpg', 'type': 'video'}, 'main_2048x1536': {'fid': '1282', 'url': 'https:\\/\\/images.tntdrama.com\\/tnt\\/$dyna_params\\/https%3A%2F%2Fi.cdn.tntdrama.com%2Fassets%2Fimages%2F2017%2F04%2FDisturbia-2048x1536.jpg', 'type': 'video'}}"
video,15481,1552096920,,,Lone Survivor [Uncut],2194463,movie,2194463,NaN,"In the mountains of Afghanistan, a squad of Taliban fighters ambushes four Navy SEALs, who are there on a mission to eliminate a high-ranking al-Qaeda operative.","Four US Navy SEALS departed one clear night in early July, 2005 for the mountainous Afghanistan-Pakistan border for a reconnaissance mission. Their task was to document the activity of an al Qaeda leader rumored to be very close to Bin Laden with a small army in a Taliban stronghold. Five days later, only one of those Navy SEALS made it out alive.","In the mountains of Afghanistan, a squad of Taliban fighters ambushes four Navy SEALs, who are there on a mission to eliminate a high-ranking al-Qaeda operative.","Four US Navy SEALS departed one clear night in early July, 2005 for the mountainous Afghanistan-Pakistan border for a reconnaissance mission. Their task was to document the activity of an al Qaeda leader rumored to be very close to Bin Laden with a small army in a Taliban stronghold. Five days later, only one of those Navy SEALS made it out alive.",,R,False,,,,94e737d30e476abb018d22a055d2351059377511,1,\/movies\/lone-survivor-uncut,https:\/\/www.tntdrama.com\/movies\/lone-survivor-uncut,7280.3065,2013,121 min,10,,,,1,"{'banner': 'NaN', 'rectangle': 'NaN', 'display_presented': True, 'sponsor_120x42': 'NaN', 'mobile_ad': 'NaN', 'display_ad_inventory_id': 'NaN'}",[],Watch On the App,https:\/\/tnt.app.link\/udlHXdoAj5,1587196800,1594972758,,,Expires July 16,,True,New,"{'main_846x700': {'fid': '16559', 'url': 'https:\\/\\/images.tntdrama.com\\/tnt\\/$dyna_params\\/https%3A%2F%2Fi.cdn.tntdrama.com%2Fassets%2Fimages%2F2020%2F03%2FLoneSurvivor-846x700.jpg', 'type': 'video'}, 'main_1024x1536': {'fid': '16555', 'url': 'https:\\/\\/images.tntdrama.com\\/tnt\\/$dyna_params\\/https%3A%2F%2Fi.cdn.tntdrama.com%2Fassets%2Fimages%2F2020%2F03%2FLoneSurvivor-1024x1536.jpg', 'type': 'video'}, 'main_1600x900': {'fid': '16557', 'url': 'https:\\/\\/images.tntdrama.com\\/tnt\\/$dyna_params\\/https%3A%2F%2Fi.cdn.tntdrama.com%2Fassets%2Fimages%2F2020%2F03%2FLoneSurvivor-1600x900.jpg', 'type': 'video'}, 'main_1692x695': {'fid': '16558', 'url': 'https:\\/\\/images.tntdrama.com\\/tnt\\/$dyna_params\\/https%3A%2F%2Fi.cdn.tntdrama.com%2Fassets%2Fimages%2F2020%2F03%2FLoneSurvivor-1692x695.jpg', 'type': 'video'}, 'tvapps_1920xjpg': {'fid': '16556', 'url': 'https:\\/\\/images.tntdrama.com\\/tnt\\/$dyna_params\\/https%3A%2F%2Fi.cdn.tntdrama.com%2Fassets%2Fimages%2F2020%2F03%2FLoneSurvivor-1920x1080.jpg', 'type': 'video'}, 'main_2048x1536': {'fid': '16554', 'url': 'https:\\/\\/images.tntdrama.com\\/tnt\\/$dyna_params\\/https%3A%2F%2Fi.cdn.tntdrama.com%2Fassets%2Fimages%2F2020%2F03%2FLoneSurvivor-2048x1536.jpg', 'type': 'video'}}"
video,16739,1557957720,,,Meet the Parents [Uncut],2197277,movie,2197277,NaN,"Greg Focker is head over heels in love with his girlfriend Pam, and is ready to pop the big question. Greg realizes the key to Pam's hand in marriage lies with her formidable father, Jack Byrnes.","Greg Focker is head over heels in love with his girlfriend Pam, and is ready to pop the big question. Greg realizes the key to Pam's hand in marriage lies with her formidable father, Jack Byrnes. A trip to New York for her sister's wedding seems just the right occasion for Greg to ask Pam to be his wife. But everything that could possibly go wrong, does. Upon his arrival at the family's picturesque home, Greg is greeted by what appears to be the picture-perfect family. But for a guy who usually resorts to dry wit in stressful situations, Greg is suddenly shooting blanks with Jack, a retired horticulturist--and rather imposing figure. No one is good enough for Jack's first-born daughter, and the fact that Greg is a cat-hating male nurse with a vulgar-sounding last name is not helping things at all. While Greg bends over backwards to try and make a good impression, his weekend begins with lost luggage at the airport and turns into a series of disasters.","Greg Focker is head over heels in love with his girlfriend Pam, and is ready to pop the big question. Greg realizes the key to Pam's hand in marriage lies with her formidable father, Jack Byrnes.","Greg Focker is head over heels in love with his girlfriend Pam, and is ready to pop the big question. Greg realizes the key to Pam's hand in marriage lies with her formidable father, Jack Byrnes. A trip to New York for her sister's wedding seems just the right occasion for Greg to ask Pam to be his wife. But everything that could possibly go wrong, does. Upon his arrival at the family's picturesque home, Greg is greeted by what appears to be the picture-perfect family. But for a guy who usually resorts to dry wit in stressful situations, Greg is suddenly shooting blanks with Jack, a retired horticulturist--and rather imposing figure. No one is good enough for Jack's first-born daughter, and the fact that Greg is a cat-hating male nurse with a vulgar-sounding last name is not helping things at all. While Greg bends over backwards to try and make a good impression, his weekend begins with lost luggage at the airport and turns into a series of disasters.",,PG-13,False,,,,0d4b953d3fc20fb161c94fca408621185e9ecf5e,1,\/movies\/meet-the-parents-uncut,https:\/\/www.tntdrama.com\/movies\/meet-the-parents-uncut,6466.5935,2000,107 min,10,,,,1,"{'banner': 'NaN', 'rectangle': 'NaN', 'display_presented': True, 'sponsor_120x42': 'NaN', 'mobile_ad': 'NaN', 'display_ad_inventory_id': 'NaN'}",[],Watch On the App,https:\/\/tnt.app.link\/Kt73fDyZs3,1585728000,1590998399,,,Expires May 31,,False,,"{'main_846x700': {'fid': '15764', 'url': 'https:\\/\\/images.tntdrama.com\\/tnt\\/$dyna_params\\/https%3A%2F%2Fi.cdn.tntdrama.com%2Fassets%2Fimages%2F2020%2F01%2FMeet-the-Parents-846x700.jpg', 'type': 'video'}, 'main_1024x1536': {'fid': '15760', 'url': 'https:\\/\\/images.tntdrama.com\\/tnt\\/$dyna_params\\/https%3A%2F%2Fi.cdn.tntdrama.com%2Fassets%2Fimages%2F2020%2F01%2FMeet-the-Parents-1024x1536.jpg', 'type': 'video'}, 'main_1600x900': {'fid': '15762', 'url': 'https:\\/\\/images.tntdrama.com\\/tnt\\/$dyna_params\\/https%3A%2F%2Fi.cdn.tntdrama.com%2Fassets%2Fimages%2F2020%2F01%2FMeet-the-Parents-1600x900.jpg', 'type': 'video'}, 'main_1692x695': {'fid': '15763', 'url': 'https:\\/\\/images.tntdrama.com\\/tnt\\/$dyna_params\\/https%3A%2F%2Fi.cdn.tntdrama.com%2Fassets%2Fimages%2F2020%2F01%2FMeet-the-Parents-1692x695.jpg', 'type': 'video'}, 'tvapps_1920xjpg': {'fid': '15761', 'url': 'https:\\/\\/images.tntdrama.com\\/tnt\\/$dyna_params\\/https%3A%2F%2Fi.cdn.tntdrama.com%2Fassets%2Fimages%2F2020%2F01%2FMeet-the-Parents-1920x1080.jpg', 'type': 'video'}, 'main_2048x1536': {'fid': '15759', 'url': 'https:\\/\\/images.tntdrama.com\\/tnt\\/$dyna_params\\/https%3A%2F%2Fi.cdn.tntdrama.com%2Fassets%2Fimages%2F2020%2F01%2FMeet-the-Parents-2048x1536.jpg', 'type': 'video'}}"
video,14634,1541520002,,,Identity Thief [Uncut],2186637,movie,2186637,NaN,"Unlimited funds have allowed Diana to live it up in Miami, where she buys whatever strikes her fancy. The ID she's using to finance these sprees reads ""Sandy Bigelow Patterson"" and belongs to an accounts rep halfway across the U.S.","Unlimited funds have allowed Diana to live it up on the outskirts of Miami, where the queen of retail buys whatever strikes her fancy. There's only one glitch: The ID she's using to finance these sprees reads ""Sandy Bigelow Patterson""... and it belongs to an accounts rep who lives halfway across the U.S. With only one week to hunt down the con artist before his world implodes, the real Sandy Bigelow Patterson heads south to confront the woman with an all-access pass to his life. And as he attempts to bribe, coax and wrangle her the 2,000 miles to Denver, one easy target will discover just how tough it is to get your name back.","Unlimited funds have allowed Diana to live it up in Miami, where she buys whatever strikes her fancy. The ID she's using to finance these sprees reads ""Sandy Bigelow Patterson"" and belongs to an accounts rep halfway across the U.S.","Unlimited funds have allowed Diana to live it up on the outskirts of Miami, where the queen of retail buys whatever strikes her fancy. There's only one glitch: The ID she's using to finance these sprees reads ""Sandy Bigelow Patterson""... and it belongs to an accounts rep who lives halfway across the U.S. With only one week to hunt down the con artist before his world implodes, the real Sandy Bigelow Patterson heads south to confront the woman with an all-access pass to his life. And as he attempts to bribe, coax and wrangle her the 2,000 miles to Denver, one easy target will discover just how tough it is to get your name back.",,R,False,,,,3665b0c2ff2e0a22fef66b84e88add414a72065d,1,\/movies\/identity-thief-uncut,https:\/\/www.tntdrama.com\/movies\/identity-thief-uncut,6691.0845,2013,111 min,10,,,,1,"{'banner': 'NaN', 'rectangle': 'NaN', 'display_presented': True, 'sponsor_120x42': 'NaN', 'mobile_ad': 'NaN', 'display_ad_inventory_id': 'NaN'}",[],Watch On the App,https:\/\/tnt.app.link\/e0mjXxZYN1,1585987200,1588665599,,,Expires May 4,,False,,"{'main_846x700': {'fid': '14914', 'url': 'https:\\/\\/images.tntdrama.com\\/tnt\\/$dyna_params\\/https%3A%2F%2Fi.cdn.tntdrama.com%2Fassets%2Fimages%2F2019%2F11%2FIdentityThief-846x700.jpg', 'type': 'video'}, 'main_1024x1536': {'fid': '14910', 'url': 'https:\\/\\/images.tntdrama.com\\/tnt\\/$dyna_params\\/https%3A%2F%2Fi.cdn.tntdrama.com%2Fassets%2Fimages%2F2019%2F11%2FIdentityThief-1024x1536.jpg', 'type': 'video'}, 'main_1600x900': {'fid': '14912', 'url': 'https:\\/\\/images.tntdrama.com\\/tnt\\/$dyna_params\\/https%3A%2F%2Fi.cdn.tntdrama.com%2Fassets%2Fimages%2F2019%2F11%2FIdentityThief-1600x900.jpg', 'type': 'video'}, 'main_1692x695': {'fid': '15304', 'url': 'https:\\/\\/images.tntdrama.com\\/tnt\\/$dyna_params\\/https%3A%2F%2Fi.cdn.tntdrama.com%2Fassets%2Fimages%2F2020%2F01%2FIdentityThief-1692x695.jpg', 'type': 'video'}, 'tvapps_1920xjpg': {'fid': '14911', 'url': 'https:\\/\\/images.tntdrama.com\\/tnt\\/$dyna_params\\/https%3A%2F%2Fi.cdn.tntdrama.com%2Fassets%2Fimages%2F2019%2F11%2FIdentityThief-1920x1080.jpg', 'type': 'video'}, 'main_2048x1536': {'fid': '14909', 'url': 'https:\\/\\/images.tntdrama.com\\/tnt\\/$dyna_params\\/https%3A%2F%2Fi.cdn.tntdrama.com%2Fassets%2Fimages%2F2019%2F11%2FIdentityThief-2048x1536.jpg', 'type': 'video'}}"
video,16775,1558368120,,,I Now Pronounce You Chuck & Larry [Uncut],2197569,movie,2197569,NaN,"Chuck Levine and Larry Valentine are the pride of their fire station. Larry wants just one thing, to protect his family. His buddy Chuck also wants one thing, to enjoy the single life.","Chuck Levine and Larry Valentine are the pride of their fire station: two guy's guys always side-by-side and willing to do anything for each other. Salt-of-the-earth widower Larry wants just one thing: to protect his family. His buddy Chuck also wants one thing: to enjoy the single life. Grateful Chuck owes Larry for saving his life in a fire, and Larry calls in that favor big time when civic red tape prevents him from naming his own two kids as his life insurance beneficiaries. All that Chuck has to do is claim to be Larry's domestic partner on some city forms. Easy. Nobody will ever know. But when an overzealous, spot-checking bureaucrat becomes suspicious, the new couple's arrangement becomes a citywide issue and goes from confidential to front-page news. Forced to improvise as love-struck newlyweds, Chuck and Larry must now fumble through a hilarious charade of domestic bliss under one roof. After surviving their mandatory honeymoon and dodging the threat of exposure, the well-intentioned con men discover sticking together in your time of need is what truly makes a family.","Chuck Levine and Larry Valentine are the pride of their fire station. Larry wants just one thing, to protect his family. His buddy Chuck also wants one thing, to enjoy the single life.","Chuck Levine and Larry Valentine are the pride of their fire station: two guy's guys always side-by-side and willing to do anything for each other. Salt-of-the-earth widower Larry wants just one thing: to protect his family. His buddy Chuck also wants one thing: to enjoy the single life. Grateful Chuck owes Larry for saving his life in a fire, and Larry calls in that favor big time when civic red tape prevents him from naming his own two kids as his life insurance beneficiaries. All that Chuck has to do is claim to be Larry's domestic partner on some city forms. Easy. Nobody will ever know. But when an overzealous, spot-checking bureaucrat becomes suspicious, the new couple's arrangement becomes a citywide issue and goes from confidential to front-page news. Forced to improvise as love-struck newlyweds, Chuck and Larry must now fumble through a hilarious charade of domestic bliss under one roof. After surviving their mandatory honeymoon and dodging the threat of exposure, the well-intentioned con men discover sticking together in your time of need is what truly makes a family.",,PG-13,False,,,,b7b545c15247da0d2234c9b2ed4a66b5b14bcc44,1,\/movies\/i-now-pronounce-you-chuck-larry-uncut,https:\/\/www.tntdrama.com\/movies\/i-now-pronounce-you-chuck-larry-uncut,6925.4852,2007,115 min,10,,,,1,"{'banner': 'NaN', 'rectangle': 'NaN', 'display_presented': True, 'sponsor_120x42': 'NaN', 'mobile_ad': 'NaN', 'display_ad_inventory_id': 'NaN'}",[],Watch On the App,https:\/\/tnt.app.link\/Cts13XqUE2,1585728000,1593590399,,,Expires June 30,,False,,"{'main_846x700': {'fid': '5712', 'url': 'https:\\/\\/images.tntdrama.com\\/tnt\\/$dyna_params\\/https%3A%2F%2Fi.cdn.tntdrama.com%2Fassets%2Fimages%2F2017%2F09%2FINowPronounceYouChuckAndLarry-846x700.jpg', 'type': 'video'}, 'main_1024x1536': {'fid': '5708', 'url': 'https:\\/\\/images.tntdrama.com\\/tnt\\/$dyna_params\\/https%3A%2F%2Fi.cdn.tntdrama.com%2Fassets%2Fimages%2F2017%2F09%2FINowPronounceYouChuckAndLarry-1024x1536.jpg', 'type': 'video'}, 'main_1600x900': {'fid': '5710', 'url': 'https:\\/\\/images.tntdrama.com\\/tnt\\/$dyna_params\\/https%3A%2F%2Fi.cdn.tntdrama.com%2Fassets%2Fimages%2F2017%2F09%2FINowPronounceYouChuckAndLarry-1600x900.jpg', 'type': 'video'}, 'main_1692x695': {'fid': '5711', 'url': 'https:\\/\\/images.tntdrama.com\\/tnt\\/$dyna_params\\/https%3A%2F%2Fi.cdn.tntdrama.com%2Fassets%2Fimages%2F2017%2F09%2FINowPronounceYouChuckAndLarry-1692x695.jpg', 'type': 'video'}, 'tvapps_1920xjpg': {'fid': '5709', 'url': 'https:\\/\\/images.tntdrama.com\\/tnt\\/$dyna_params\\/https%3A%2F%2Fi.cdn.tntdrama.com%2Fassets%2Fimages%2F2017%2F09%2FINowPronounceYouChuckAndLarry-1920x1080.jpg', 'type': 'video'}, 'main_2048x1536': {'fid': '5707', 'url': 'https:\\/\\/images.tntdrama.com\\/tnt\\/$dyna_params\\/https%3A%2F%2Fi.cdn.tntdrama.com%2Fassets%2Fimages%2F2017%2F09%2FINowPronounceYouChuckAndLarry-2048x1536.jpg', 'type': 'video'}}"
