videoId,type,tvRating,title,url,id,mediaID,seriesTitleId,seasonEpisode,subtitle,image16x9,durationFormatted,shortDescription,squeezetime,expireDateFormatted,duration,authRequired,videoType,entityType,created,teaserType,seriesReference,titleId,seriesId,description,shortDescriptionNoTags,descriptionNoTags,metaDescription,originalPremierDate,originalPremierDateFormatted,season,episode,canonicalUrl,releaseYear,episodeReference,movieReference,seriesPrimaryCollection,isPlayable,ads,tags,deeplinkTitle,deeplinkUri,startTime,endTime,availableOn,airsOn,expiresOn,newStatus,availabilityInfo,images,seriesLogo,seriesLogoImage,videoLogoImage,jsCanUseThisPlaylistItemAsIs,genre,language,bot_country,availabilityStarts,availabilityEnds,bot_system,offer_type
2189982,episode,TV-MA,Fly Like an Eagle,\/shows\/claws\/season-3\/episode-6\/fly-like-an-eagle,14971,183bb431c1f07395b8472db9d48a225f35aee6fd,2094392,S3 | E6,Fly Like an Eagle,https:\/\/images.tntdrama.com\/tnt\/$dyna_params\/https%3A%2F%2Fi.cdn.tntdrama.com%2Fassets%2Fimages%2F2019%2F07%2FClaws-S03E06-FlyLikeAnEagle-1600x900.jpg,45 min,"After successfully leveraging what she knows about Governor Patel in an attempt to win her brother back, a victorious Desna returns to the casino, only to learn that Dean is more entranced under Mac and Melba's spell than she realized.",10,Expires April 21,2745.5095,1,episode,,,,,,,,,,,,,,,,,,,,,,,,,,,,,,,,,,,,,WatchAction,en,US,2020-04-15T08:00:00+00:00,2020-04-22T07:59:59+00:00,TNT,TVE
2189983,episode,TV-MA,Chicken P***Y,\/shows\/claws\/season-3\/episode-7\/chicken-py,14975,1ef487d03c78cb73c8021fd13e745546786632cc,2094392,S3 | E7,Chicken P***Y,https:\/\/images.tntdrama.com\/tnt\/$dyna_params\/https%3A%2F%2Fi.cdn.tntdrama.com%2Fassets%2Fimages%2F2019%2F07%2FClaws-S03E07-ChickenP___y-1600x900.jpg,46 min,"While Desna works to get Dean away from Mac and Melba, Quiet Ann gets the crew deeper into trouble.",10,Expires April 21,2769.0661,1,episode,,,,,,,,,,,,,,,,,,,,,,,,,,,,,,,,,,,,,WatchAction,en,US,2020-04-15T08:00:00+00:00,2020-04-22T07:59:59+00:00,TNT,TVE
2189984,episode,TV-MA,What is Happening to America,\/shows\/claws\/season-3\/episode-8\/what-is-happening-to-america,14970,a9879bd782ce3e000dca3f242478fa5c3d1bf3a1,2094392,S3 | E8,What is Happening to America,https:\/\/images.tntdrama.com\/tnt\/$dyna_params\/https%3A%2F%2Fi.cdn.tntdrama.com%2Fassets%2Fimages%2F2019%2F07%2FClaws-S03E08-1600x900.jpg,44 min,The crew makes elaborate plans to pay back the casino's debts only to learn that they're nowhere near being out of the woods.,10,Expires April 21,2644.5753,1,episode,,,,,,,,,,,,,,,,,,,,,,,,,,,,,,,,,,,,,WatchAction,en,US,2020-04-15T08:00:00+00:00,2020-04-22T07:59:59+00:00,TNT,TVE
2189985,episode,TV-MA,Melba Toast,\/shows\/claws\/season-3\/episode-9\/melba-toast,14977,b6c380b951ef32ae1eb3fb952609fa3b0622f2bf,2094392,S3 | E9,Melba Toast,https:\/\/images.tntdrama.com\/tnt\/$dyna_params\/https%3A%2F%2Fi.cdn.tntdrama.com%2Fassets%2Fimages%2F2019%2F08%2FClaws-S03-Generic1-1600x900.jpg,45 min,"Desna and the crew have to tie up loose ends for the Triads if they want to stay alive. Meanwhile, guilt pushes Toby to do the unexpected, putting the entire crew in jeopardy.",10,Expires April 21,2703.5008,1,episode,,,,,,,,,,,,,,,,,,,,,,,,,,,,,,,,,,,,,WatchAction,en,US,2020-04-15T08:00:00+00:00,2020-04-22T07:59:59+00:00,TNT,TVE
2189986,,TV-MA,Finna,\/shows\/claws\/season-3\/episode-10\/finna,14973,31a7477cbc87c12301fefe9279a28b105a9ad892,2094392,,,,45 min,"Just when the crew thought that they could boss up, fate takes a turn on Desna and Roller. As the walls close in on Desna's Queendom, she is forced to make a choice no one would have expected.",10,Expires April 21,2753.0502,1,episode,video,1547251320.0,,6140,2189986,6140,"Just when the crew thought that they could boss up, fate takes a turn on Desna (Niecy Nash) and Roller (Jack Kesy). As the walls close in on Desna's Queendom, she is forced to make a choice no one would have expected.","Just when the crew thought that they could boss up, fate takes a turn on Desna and Roller. As the walls close in on Desna's Queendom, she is forced to make a choice no one would have expected.","Just when the crew thought that they could boss up, fate takes a turn on Desna (Niecy Nash) and Roller (Jack Kesy). As the walls close in on Desna's Queendom, she is forced to make a choice no one would have expected.","As the walls close in on Desna's Queendom, she is forced to make a choice no one would have expected.",1565571600,2019-08-11T21:00:00,3,10,https:\/\/www.tntdrama.com\/shows\/claws\/season-3\/episode-10\/finna,2019,,,14774,1,"{'banner': 'tnt_shows_claws_lb', 'rectangle': 'tnt_shows_claws', 'display_presented': True, 'sponsor_120x42': 'tnt_shows_claws_logo', 'mobile_ad': 'claws', 'display_ad_inventory_id': 'TNT\\/shows\\/claws'}",[],Watch On the App,https:\/\/tnt.app.link\/iX2zpxm30Y,1586937600.0,1587542399.0,,,Expires in 2 days,True,Expires in 2 days,"{'tvapps_846x700': {'fid': '12815', 'url': 'https:\\/\\/images.tntdrama.com\\/tnt\\/$dyna_params\\/https%3A%2F%2Fi.cdn.tntdrama.com%2Fassets%2Fimages%2F2019%2F05%2FClaws-846x700.jpg', 'type': 'series'}, 'main_1024x1536': {'fid': '12813', 'url': 'https:\\/\\/images.tntdrama.com\\/tnt\\/$dyna_params\\/https%3A%2F%2Fi.cdn.tntdrama.com%2Fassets%2Fimages%2F2019%2F05%2FClaws-1024x1536.jpg', 'type': 'series'}, 'main_1600x900': {'fid': '13526', 'url': 'https:\\/\\/images.tntdrama.com\\/tnt\\/$dyna_params\\/https%3A%2F%2Fi.cdn.tntdrama.com%2Fassets%2Fimages%2F2019%2F08%2FClaws-S03E10-1600x900.jpg', 'type': 'video'}, 'main_1692x695': {'fid': '12832', 'url': 'https:\\/\\/images.tntdrama.com\\/tnt\\/$dyna_params\\/https%3A%2F%2Fi.cdn.tntdrama.com%2Fassets%2Fimages%2F2019%2F05%2FClaws-Alt-1692x695.jpg', 'type': 'series'}, 'tvapps_1920xjpg': {'fid': '12812', 'url': 'https:\\/\\/images.tntdrama.com\\/tnt\\/$dyna_params\\/https%3A%2F%2Fi.cdn.tntdrama.com%2Fassets%2Fimages%2F2019%2F05%2FClaws-1920x1080.jpg', 'type': 'series'}, 'main_2048x1536': {'fid': '12811', 'url': 'https:\\/\\/images.tntdrama.com\\/tnt\\/$dyna_params\\/https%3A%2F%2Fi.cdn.tntdrama.com%2Fassets%2Fimages%2F2019%2F05%2FClaws-2048x1536.jpg', 'type': 'series'}, 'main_900x360': {'fid': '12816', 'url': 'https:\\/\\/images.tntdrama.com\\/tnt\\/$dyna_params\\/https%3A%2F%2Fi.cdn.tntdrama.com%2Fassets%2Fimages%2F2019%2F05%2FClaws-Logo-900x360.png', 'type': 'series'}, 'main_2_900x360': {'fid': '12817', 'url': 'https:\\/\\/images.tntdrama.com\\/tnt\\/$dyna_params\\/https%3A%2F%2Fi.cdn.tntdrama.com%2Fassets%2Fimages%2F2019%2F05%2FClaws-Logo-900x294.png', 'type': 'series'}}",16026,https:\/\/i.cdn.tntdrama.com\/assets\/images\/2019\/05\/Claws-Logo-900x360.png,https:\/\/images.tntdrama.com\/tnt\/$dyna_params\/https%3A%2F%2Fi.cdn.tntdrama.com%2Fassets%2Fimages%2F2019%2F05%2FClaws-Logo-900x360.png,True,WatchAction,en,US,2020-04-15T08:00:00+00:00,2020-04-22T07:59:59+00:00,TNT,TVE
2063889,episode,TV-MA,The Play's the Thing,\/shows\/will\/season-1\/episode-1\/the-plays-the-thing,9772,fd0b3fe86a3037c6f08fcc6ad355b75e31b733fc,2063888,S1 | E1,The Play's the Thing,https:\/\/images.tntdrama.com\/tnt\/$dyna_params\/https%3A%2F%2Fi.cdn.tntdrama.com%2Fassets%2Fimages%2F2017%2F07%2FWill-S1E1-1600x900.jpg,61 min,"It's 1589, a time of religious turmoil in Protestant England when to be Catholic could be a death sentence - Will Shakespeare arrives from the small town of Stratford to the wild streets of London with a dream and a treacherous letter.",10,Expires April 30,3673.6366,1,episode,,,,,,,,,,,,,,,,,,,,,,,,,,,,,,,,,,,,,WatchAction,en,US,2020-04-02T08:00:00+00:00,2020-05-01T07:59:59+00:00,TNT,TVE
2063890,episode,TV-MA,Cowards Die Many Times,\/shows\/will\/season-1\/episode-2\/cowards-die-many-times,9773,7a0600c62dbdb1353f179d60f0baab3cce67865a,2063888,S1 | E2,Cowards Die Many Times,https:\/\/images.tntdrama.com\/tnt\/$dyna_params\/https%3A%2F%2Fi.cdn.tntdrama.com%2Fassets%2Fimages%2F2017%2F07%2FWill-S1E2-1600x900.jpg,53 min,"Will is wracked with guilt over the arrest of the rival playwright, Baxter; he makes a dangerous confession to the beautiful Alice. The future of the theatre is threatened when the crowd-pleasing actor, Kemp, is tempted by another playhouse. ",10,Expires April 30,3194.4246,1,episode,,,,,,,,,,,,,,,,,,,,,,,,,,,,,,,,,,,,,WatchAction,en,US,2020-04-02T08:00:00+00:00,2020-05-01T07:59:59+00:00,TNT,TVE
2063891,episode,TV-MA,The Two Gentlemen,\/shows\/will\/season-1\/episode-3\/the-two-gentlemen,9777,82289999a4dc323580d008de3e900d548aa2d0bb,2063888,S1 | E3,The Two Gentlemen,https:\/\/images.tntdrama.com\/tnt\/$dyna_params\/https%3A%2F%2Fi.cdn.tntdrama.com%2Fassets%2Fimages%2F2017%2F07%2FWill-S1E3-1600x900.jpg,51 min,"Will has an epiphany, which could lead him to success but he needs Alice's help. A charismatic fugitive from Will's past burdens him with a dangerous obligation. ",10,Expires April 30,3094.992,1,episode,,,,,,,,,,,,,,,,,,,,,,,,,,,,,,,,,,,,,WatchAction,en,US,2020-04-02T08:00:00+00:00,2020-05-01T07:59:59+00:00,TNT,TVE
2063892,episode,TV-MA,Brave New World,\/shows\/will\/season-1\/episode-4\/brave-new-world,9776,0af68544c8b6eb6dc075ef7278ec7676adb46fe0,2063888,S1 | E4,Brave New World,https:\/\/images.tntdrama.com\/tnt\/$dyna_params\/https%3A%2F%2Fi.cdn.tntdrama.com%2Fassets%2Fimages%2F2017%2F07%2FWill-S1E4-1600x900.jpg,52 min,Marlowe introduces Will to the decadent elite of London but things take a macabre turn. Alice is disillusioned and Will must fight for all that he holds dear.,10,Expires April 30,3154,1,episode,,,,,,,,,,,,,,,,,,,,,,,,,,,,,,,,,,,,,WatchAction,en,US,2020-04-02T08:00:00+00:00,2020-05-01T07:59:59+00:00,TNT,TVE
2063893,,TV-MA,The Marriage of True Minds,\/shows\/will\/season-1\/episode-5\/the-marriage-of-True-minds,9778,9106c3feed68076235d0843be0767330243bf9cd,2063888,,,,51 min,An unexpected arrival from out-of-town sends Will's world spinning. A transcendental experience leads Marlowe (Jamie Campbell Bower) to deal with his past. Topcliffe deciphers a code that throws Will into a life and death situation.  ,10,Expires April 30,3102.3326,1,episode,video,1498663802.0,,9747,2063893,9747,"<p>An unexpected arrival from out-of-town sends Will's world spinning. A transcendental experience leads Marlowe to deal with his past. Topcliffe deciphers a code that throws Will into a life and death situation.<\/p>
",An unexpected arrival from out-of-town sends Will's world spinning. A transcendental experience leads Marlowe (Jamie Campbell Bower) to deal with his past. Topcliffe deciphers a code that throws Will into a life and death situation.  ,An unexpected arrival from out-of-town sends Will's world spinning. A transcendental experience leads Marlowe to deal with his past. Topcliffe deciphers a code that throws Will into a life and death situation.  ,,1501563600,2017-07-31T21:00:00,1,5,https:\/\/www.tntdrama.com\/shows\/will\/season-1\/episode-5\/the-marriage-of-True-minds,2017,,,14780,1,"{'banner': 'tnt_shows_will_lb', 'rectangle': 'tnt_shows_will', 'display_presented': True, 'sponsor_120x42': 'tnt_shows_will_logo', 'mobile_ad': 'NaN', 'display_ad_inventory_id': 'TNT\\/shows\\/will'}",[],Watch On the App,https:\/\/tnt.app.link\/znhXxh7WtN,1585814400.0,1588319999.0,,,,False,,"{'tvapps_846x700': {'fid': '955', 'url': 'https:\\/\\/images.tntdrama.com\\/tnt\\/$dyna_params\\/https%3A%2F%2Fi.cdn.tntdrama.com%2Fassets%2Fimages%2F2017%2F03%2FWill-846x700.jpg', 'type': 'series'}, 'main_1024x1536': {'fid': '4881', 'url': 'https:\\/\\/images.tntdrama.com\\/tnt\\/$dyna_params\\/https%3A%2F%2Fi.cdn.tntdrama.com%2Fassets%2Fimages%2F2017%2F07%2FWill-v2-1024x1536.jpg', 'type': 'series'}, 'main_1600x900': {'fid': '4917', 'url': 'https:\\/\\/images.tntdrama.com\\/tnt\\/$dyna_params\\/https%3A%2F%2Fi.cdn.tntdrama.com%2Fassets%2Fimages%2F2017%2F07%2FWill-S1E5-1600x900a.jpg', 'type': 'video'}, 'main_1692x695': {'fid': '4860', 'url': 'https:\\/\\/images.tntdrama.com\\/tnt\\/$dyna_params\\/https%3A%2F%2Fi.cdn.tntdrama.com%2Fassets%2Fimages%2F2017%2F07%2FWill-v2-1692x695.jpg', 'type': 'series'}, 'tvapps_1920xjpg': {'fid': '4863', 'url': 'https:\\/\\/images.tntdrama.com\\/tnt\\/$dyna_params\\/https%3A%2F%2Fi.cdn.tntdrama.com%2Fassets%2Fimages%2F2017%2F07%2FWill-v2-1920x1080.jpg', 'type': 'series'}, 'main_2048x1536': {'fid': '4862', 'url': 'https:\\/\\/images.tntdrama.com\\/tnt\\/$dyna_params\\/https%3A%2F%2Fi.cdn.tntdrama.com%2Fassets%2Fimages%2F2017%2F07%2FWill-v2-2048x1536.jpg', 'type': 'series'}, 'main_900x360': {'fid': '8747', 'url': 'https:\\/\\/images.tntdrama.com\\/tnt\\/$dyna_params\\/https%3A%2F%2Fi.cdn.tntdrama.com%2Fassets%2Fimages%2F2018%2F06%2FTNT-Originals-Will_900x360.png', 'type': 'series'}, 'main_2_900x360': {'fid': '11247', 'url': 'https:\\/\\/images.tntdrama.com\\/tnt\\/$dyna_params\\/https%3A%2F%2Fi.cdn.tntdrama.com%2Fassets%2Fimages%2F2019%2F01%2FWill-logo-CROPPED-900x270.png', 'type': 'series'}}",11733,https:\/\/i.cdn.tntdrama.com\/assets\/images\/2018\/06\/TNT-Originals-Will_900x360.png,https:\/\/images.tntdrama.com\/tnt\/$dyna_params\/https%3A%2F%2Fi.cdn.tntdrama.com%2Fassets%2Fimages%2F2018%2F06%2FTNT-Originals-Will_900x360.png,True,WatchAction,en,US,2020-04-02T08:00:00+00:00,2020-05-01T07:59:59+00:00,TNT,TVE
2063894,episode,TV-MA,Something Wicked This Way Comes.,\/shows\/will\/season-1\/episode-6\/something-wicked-this-way-comes,9775,5215a13d103f21a4bb023917b2286bdd02456a86,2063888,S1 | E6,Something Wicked This Way Comes.,https:\/\/images.tntdrama.com\/tnt\/$dyna_params\/https%3A%2F%2Fi.cdn.tntdrama.com%2Fassets%2Fimages%2F2017%2F07%2FWill-S1E6-1600x900.jpg,53 min,"Tensions rise as Will and Alice continue to collaborate, while Anne attempts to adjust to London life. Love forces Marlowe to confront his darkest fears. Presto is forced to confront True evil.",10,Expires April 30,3225.0551,1,episode,,,,,,,,,,,,,,,,,,,,,,,,,,,,,,,,,,,,,WatchAction,en,US,2020-04-02T08:00:00+00:00,2020-05-01T07:59:59+00:00,TNT,TVE
2063895,episode,TV-MA,What Dreams May Come,\/shows\/will\/season-1\/episode-7\/what-dreams-may-come,9781,c43deb2204346ad4fc0a40a088901c33c65a95b6,2063888,S1 | E7,What Dreams May Come,https:\/\/images.tntdrama.com\/tnt\/$dyna_params\/https%3A%2F%2Fi.cdn.tntdrama.com%2Fassets%2Fimages%2F2017%2F07%2FWill-S1E7-1600x900.jpg,48 min,"With the theatre in jeopardy, Will enlists the help of a beautiful and talented friend. Alice turns to Southwell for comfort and an existential crisis leads Marlowe back to the dubious Edward Kelly.",10,Expires April 30,2931.5953,1,episode,,,,,,,,,,,,,,,,,,,,,,,,,,,,,,,,,,,,,WatchAction,en,US,2020-04-02T08:00:00+00:00,2020-05-01T07:59:59+00:00,TNT,TVE
2063896,episode,TV-MA,Your Houses,\/shows\/will\/season-1\/episode-8\/your-houses,9780,bf4f1bc74d26a70c1258ab711d9e0c6b874834a1,2063888,S1 | E8,Your Houses,https:\/\/images.tntdrama.com\/tnt\/$dyna_params\/https%3A%2F%2Fi.cdn.tntdrama.com%2Fassets%2Fimages%2F2017%2F07%2FWill-S1E8-1600x900.jpg,50 min,"Will is shocked to learn of Alice's new passion. Haunted by his inability to write, Marlowe embarks on a self-destructive path. Plague haunts London, and Richard discovers what he believes in.",10,Expires April 30,3036.4,1,episode,,,,,,,,,,,,,,,,,,,,,,,,,,,,,,,,,,,,,WatchAction,en,US,2020-04-02T08:00:00+00:00,2020-05-01T07:59:59+00:00,TNT,TVE
2063897,episode,TV-MA,Play the Devil,\/shows\/will\/season-1\/episode-9\/play-the-devil,9779,df024d7c5970cc48a2c9cbcb6c13c1c47234c6fb,2063888,S1 | E9,Play the Devil,https:\/\/images.tntdrama.com\/tnt\/$dyna_params\/https%3A%2F%2Fi.cdn.tntdrama.com%2Fassets%2Fimages%2F2017%2F07%2FWill-S1E9-1600x900.jpg,49 min,"To write his new play, Will (Laurie Davidson) must confront Topcliffe (Ewen Bremner). To achieve greatness Richard (Mattias Inwood) must tell his father a harsh truth. Alice (Olivia DeJonge) contemplates a perilous mission.",10,Expires April 30,2951.6487,1,episode,,,,,,,,,,,,,,,,,,,,,,,,,,,,,,,,,,,,,WatchAction,en,US,2020-04-02T08:00:00+00:00,2020-05-01T07:59:59+00:00,TNT,TVE
2063898,episode,TV-MA,"Once, Bright Angel",\/shows\/will\/season-1\/episode-10\/once-bright-angel,9774,ce5d7920dffd3bed5e90538de3829da39c3ccfb6,2063888,S1 | E10,"Once, Bright Angel",https:\/\/images.tntdrama.com\/tnt\/$dyna_params\/https%3A%2F%2Fi.cdn.tntdrama.com%2Fassets%2Fimages%2F2017%2F07%2FWill-S1E10-1600x900.jpg,52 min,Will and the company are shocked by a terrible discovery; they must risk everything in a life and death struggle for survival.,10,Expires April 30,3165.5958,1,episode,,,,,,,,,,,,,,,,,,,,,,,,,,,,,,,,,,,,,WatchAction,en,US,2020-04-02T08:00:00+00:00,2020-05-01T07:59:59+00:00,TNT,TVE
2142242,episode,TV-MA-LS,French Fries,\/shows\/shatterbox\/season-1\/episode-1\/french-fries,13325,6654f36dabbceb9c880dab4fdade9cae2fae0403,2142240,S1 | E1,French Fries,https:\/\/images.tntdrama.com\/tnt\/$dyna_params\/https%3A%2F%2Fi.cdn.tntdrama.com%2Fassets%2Fimages%2F2018%2F06%2Ffrenchfriesfilm-1600x900.jpg,14 min,"French Fries explores a young, hip African-American foodie couple’s fight to resolve communication problems in a modern marriage of 6 years, 4 months and 3-1\/2 days.
 

 
",10,Expires December 30,890,0,episode,,,,,,,,,,,,,,,,,,,,,,,,,,,,,,,,,,,,,,,,,,,
2142244,episode,TV-14,One Cambodian Family Please for My Pleasure,\/shows\/shatterbox\/season-1\/episode-2\/one-cambodian-family-please-for-my-pleasure,13324,c1785d64268da22598c6e8b533414ccf7d1631c6,2142240,S1 | E2,One Cambodian Family Please for My Pleasure,https:\/\/images.tntdrama.com\/tnt\/$dyna_params\/https%3A%2F%2Fi.cdn.tntdrama.com%2Fassets%2Fimages%2F2018%2F08%2FShatterbox-OneCambodiaFamilyPlease-1600x900.jpg,12 min,"When news of the Cambodian genocide hits, Franka (a Czechoslovakian refugee) reaches out to the Lutheran Refugee Service in hopes of welcoming a family like hers to her new life in Fargo. Starring Emily Mortimer. ",10,Expires December 30,751.7844,0,episode,,,,,,,,,,,,,,,,,,,,,,,,,,,,,,,,,,,,,,,,,,,
2142245,episode,TV-14,X,\/shows\/shatterbox\/season-1\/episode-3\/x,13329,810fbbfd1c8de5ef5a47bcea98afd1cd174cf95a,2142240,S1 | E3,X,https:\/\/images.tntdrama.com\/tnt\/$dyna_params\/https%3A%2F%2Fi.cdn.tntdrama.com%2Fassets%2Fimages%2F2018%2F08%2FShatterbox-X-1600x900.jpg,13 min,"Modern take on French impressionism, The Red Balloon, X, a young black kid, wanders LA confronting the difficult realities of adolescence, and being black in America. Stars D'Kristian Lamar, Kyler Nesbitt, Layla Crawford, Michael Goodman.",10,Expires December 30,796.8294,0,episode,,,,,,,,,,,,,,,,,,,,,,,,,,,,,,,,,,,,,,,,,,,
2143041,episode,TV-14,The Godmother,\/shows\/shatterbox\/season-1\/episode-4\/the-godmother,13327,64424b0ef64e8d55f51553312970fd6e888bb7db,2142240,S1 | E4,The Godmother,https:\/\/images.tntdrama.com\/tnt\/$dyna_params\/https%3A%2F%2Fi.cdn.tntdrama.com%2Fassets%2Fimages%2F2018%2F08%2FShatterbox-TheGodmother-1600x900.jpg,8 min,A Godmother's promise is to spiritually guide and support their Godchild...even after they've spent the night in their car after a blowout at the bar. Starring Lauren Ash.,10,Expires December 30,519.9194,0,episode,,,,,,,,,,,,,,,,,,,,,,,,,,,,,,,,,,,,,,,,,,,
2142243,,TV-MA,Are You Still Singing?,\/shows\/shatterbox\/season-1\/episode-5\/are-you-still-singing,13328,528c395f8fa93cae4252fb05a79ae78a057354f5,2142240,,,,11 min,"As Joy Fields ends her marriage, she finds herself trying to financially stay afloat by becoming a telegram singer. Add an anxiety disorder to the mix, and welcome to the new life she's created for herself. Starring Joey Ally & Ian Harding.",10,Expires December 30,695,0,episode,video,1524152702.0,,13323,2142243,13323,"When Joy Fields ends her comfortable marriage, she finds herself trying to financially stay afloat by becoming a telegram singer. Add an anxiety disorder to the mix, and welcome to the new life she's created for herself. Starring Joey Ally & Ian Harding.","As Joy Fields ends her marriage, she finds herself trying to financially stay afloat by becoming a telegram singer. Add an anxiety disorder to the mix, and welcome to the new life she's created for herself. Starring Joey Ally & Ian Harding.","When Joy Fields ends her comfortable marriage, she finds herself trying to financially stay afloat by becoming a telegram singer. Add an anxiety disorder to the mix, and welcome to the new life she's created for herself. Starring Joey Ally & Ian Harding.",,False,,1,5,https:\/\/www.tntdrama.com\/shows\/shatterbox\/season-1\/episode-5\/are-you-still-singing,2018,,,14779,1,"{'banner': 'NaN', 'rectangle': 'NaN', 'display_presented': True, 'sponsor_120x42': 'tnt_shows_shatterbox', 'mobile_ad': 'shatterbox', 'display_ad_inventory_id': 'TNT\\/shows\\/shatterbox'}",[],Watch On the App,https:\/\/tnt.app.link\/NKYvUEnJMP,1585814400.0,1609408799.0,,,,False,,"{'main_846x700': {'fid': '9665', 'url': 'https:\\/\\/images.tntdrama.com\\/tnt\\/$dyna_params\\/https%3A%2F%2Fi.cdn.tntdrama.com%2Fassets%2Fimages%2F2018%2F09%2FShatterbox-AreYouStillSinging-846x700.jpg', 'type': 'video'}, 'main_1024x1536': {'fid': '9662', 'url': 'https:\\/\\/images.tntdrama.com\\/tnt\\/$dyna_params\\/https%3A%2F%2Fi.cdn.tntdrama.com%2Fassets%2Fimages%2F2018%2F09%2FShatterbox-AreYouStillSinging-1024x1536.jpg', 'type': 'video'}, 'main_1600x900': {'fid': '9544', 'url': 'https:\\/\\/images.tntdrama.com\\/tnt\\/$dyna_params\\/https%3A%2F%2Fi.cdn.tntdrama.com%2Fassets%2Fimages%2F2018%2F08%2FShatterbox-AreYouStillSinging-1600x900.jpg', 'type': 'video'}, 'main_1692x695': {'fid': '9664', 'url': 'https:\\/\\/images.tntdrama.com\\/tnt\\/$dyna_params\\/https%3A%2F%2Fi.cdn.tntdrama.com%2Fassets%2Fimages%2F2018%2F09%2FShatterbox-AreYouStillSinging-1692x695.jpg', 'type': 'video'}, 'tvapps_1920xjpg': {'fid': '9663', 'url': 'https:\\/\\/images.tntdrama.com\\/tnt\\/$dyna_params\\/https%3A%2F%2Fi.cdn.tntdrama.com%2Fassets%2Fimages%2F2018%2F09%2FShatterbox-AreYouStillSinging-1920x1080.jpg', 'type': 'video'}, 'main_2048x1536': {'fid': '9661', 'url': 'https:\\/\\/images.tntdrama.com\\/tnt\\/$dyna_params\\/https%3A%2F%2Fi.cdn.tntdrama.com%2Fassets%2Fimages%2F2018%2F09%2FShatterbox-AreYouStillSinging-2048x1536.jpg', 'type': 'video'}, 'main_900x360': {'fid': '9627', 'url': 'https:\\/\\/images.tntdrama.com\\/tnt\\/$dyna_params\\/https%3A%2F%2Fi.cdn.tntdrama.com%2Fassets%2Fimages%2F2018%2F09%2FShatterboxV5-900x360.png', 'type': 'series'}, 'main_2_900x360': {'fid': '11245', 'url': 'https:\\/\\/images.tntdrama.com\\/tnt\\/$dyna_params\\/https%3A%2F%2Fi.cdn.tntdrama.com%2Fassets%2Fimages%2F2019%2F01%2FShatterbox-logo-CROPPED-900x74.png', 'type': 'series'}}",12609,https:\/\/i.cdn.tntdrama.com\/assets\/images\/2018\/09\/ShatterboxV5-900x360.png,https:\/\/images.tntdrama.com\/tnt\/$dyna_params\/https%3A%2F%2Fi.cdn.tntdrama.com%2Fassets%2Fimages%2F2018%2F09%2FShatterboxV5-900x360.png,True,,,,,,,
2166548,episode,TV-14,Curated,\/shows\/shatterbox\/season-1\/episode-6\/curated,13461,49985a2774def792b4d52860196e800fb435b304,2142240,S1 | E6,Curated,https:\/\/images.tntdrama.com\/tnt\/$dyna_params\/https%3A%2F%2Fi.cdn.tntdrama.com%2Fassets%2Fimages%2F2018%2F08%2FShatterbox-Curated-1600x900.jpg,10 min,"During a reluctant trip to her late Grandmother's home in the middle of nowhere, Nancy learns that a person's sentiment and complexities aren't limited to the things they leave behind. Starring Ahna O'Reilly, Danny Pudi, and Jefferson Mays.",10,Expires December 30,612.7788,0,episode,,,,,,,,,,,,,,,,,,,,,,,,,,,,,,,,,,,,,,,,,,,
2142241,episode,TV-MA,End of the Line,\/shows\/shatterbox\/season-1\/episode-7\/end-of-the-line,13326,c512357659c25464974b594577929db4bffccca8,2142240,S1 | E7,End of the Line,https:\/\/images.tntdrama.com\/tnt\/$dyna_params\/https%3A%2F%2Fi.cdn.tntdrama.com%2Fassets%2Fimages%2F2018%2F08%2FShatterbox-EndOfTheLine-1600x900.jpg,13 min,A lonely man goes to the pet store and buys a tiny man in a cage. Starring Simon Helberg and Brett Gelman.,10,Expires December 30,827,0,episode,,,,,,,,,,,,,,,,,,,,,,,,,,,,,,,,,,,,,,,,,,,
2165770,episode,TV-14,CTRL,\/shows\/shatterbox\/season-1\/episode-8\/ctrl,13361,c2478be74397a08a0dbc9b5021e2927d171b3301,2142240,S1 | E8,CTRL,https:\/\/images.tntdrama.com\/tnt\/$dyna_params\/https%3A%2F%2Fi.cdn.tntdrama.com%2Fassets%2Fimages%2F2018%2F08%2FShatterbox-CTRL-1600x900.jpg,5 min,"2041. While an unorthodox virus ravages the digital battlefields of Cyber War II, a renegade hacker and her interrogating CyberFed share far more than a mutual interest in the virus's origins. Starring Jamie Chung & Shiva Negar.",10,Expires December 30,342.8425,0,episode,,,,,,,,,,,,,,,,,,,,,,,,,,,,,,,,,,,,,,,,,,,
2172503,episode,TV-MA,Janine,\/shows\/animal-kingdom\/season-4\/episode-1\/janine,14229,3a3e43d9cc7c8ea3d1be05c23d2f9de2e87f84b2,2063877,S4 | E1,Janine,https:\/\/images.tntdrama.com\/tnt\/$dyna_params\/https%3A%2F%2Fi.cdn.tntdrama.com%2Fassets%2Fimages%2F2019%2F05%2FAnimalKingdom-S04E01-Janine-1600x900.jpg,45 min,"Season 4 starts as the Codys pull off a risky robbery. Smurf and Pope remain at odds even as Pope finds a new outlet for his anger. Deran involves Adrian in the family business, and J tests the waters of his new identity outside the family.",10,Expires April 23,2758.8895,1,episode,,,,,,,,,,,,,,,,,,,,,,,,,,,,,,,,,,,,,WatchAction,en,US,2020-04-17T08:00:00+00:00,2020-04-24T07:59:59+00:00,TNT,TVE
